46476380,AMTAGRA COOPERATIVĂ AGRICOLĂ,Botoşani,Mihăileni,,4621,4746441,2205522,1031143,0,7,1
47657644,SOLGRANA COOPERATIVĂ AGRICOLĂ,Iaşi,Valea Lupului,,4621,4632637,0,138482,0,10,1
44912980,SEPSI TEJ COOPERATIVĂ AGRICOLĂ,Covasna,Valea Crişului,Telefon mobil: 0729858059; Adresa de e-mail: zsombnorbsrl@gmail.com; ,0141,4621699,1022374,0,93296,6,1
40378855,AGRO CROPLIFE COOPERATIVĂ AGRICOLĂ,Olt,Izbiceni,,,4528288,0,207038,0,5,0
45347795,PROAGRO GRĂDIȘTEA COOPERATIVĂ AGRICOLĂ,Călăraşi,Gradiştea,,4621,4509097,3862243,272,0,17,0
44968069,TOP AGRI BĂRĂGANUL COOPERATIVĂ AGRICOLĂ,Buzău,Bentu,,4621,4456715,4492197,94994,0,10,1
39652980,AGRO VIŞANI COOPERATIVĂ AGRICOLĂ,Brăila,Visani,,4621,4449281,1871923,1047757,0,5,2
44671326,COOPERATIVA AGRICOLĂ FERMELE BEL CONCEPT,Bihor,Sîntandrei,,0111,4442204,6332414,838,0,5,2
48326436,COOPERATIVA AGRICOLĂ OREZEANU,Brăila,Silistraru,Telefon mobil: 0744589167; Adresa de e-mail: marilena_alexandra@yahoo.com; ,4621,4397936,0,110257,0,15,0
45279836,FERMIERII DIN BANAT - CRIȘANA COOPERATIVĂ AGRICOLĂ,Arad,Oraş Pecica,,4621,4381550,923196,718,0,11,1
45087512,RURAL IBERICA COOPERATIVĂ AGRICOLĂ,Dolj,Giubega,Telefon: 0755152602; ,0111,4338992,3815667,4493521,0,5,0
41791689,AGROCOOP APA COOPERATIVĂ AGRICOLĂ,Satu Mare,Apa,,0111,4332043,4150852,128,0,5,1
44983204,SIMAGRO BRG COOPERATIVĂ AGRICOLĂ,Timiş,Variaş,,4621,4289294,0,54771,0,10,0
39686983,COOPERATIVA AGRICOLĂ AGRO MATIAS MUNTENIA,Buzău,Câmpeni,Telefon: 0729883442; ,0111,4281348,2410380,61138,0,9,1
37456619,NEW LIFE CĂCIULATU COOPERATIVA AGRICOLĂ,Dolj,Căciulatu,Telefon: 0764520548; ,0111,4247450,621126,913705,0,6,2
44870396,AGROTECH GRUP SĂLCIOARA COOPERATIVĂ AGRICOLĂ,Ialomiţa,Sălcioara,Telefon mobil: 0768268222; ,4621,4183682,212604,9133,0,6,0
40232298,TARINA VISEU COOPERATIVA AGRICOLĂ,Maramureş,Vişeu de Jos,,,4167645,0,1661,0,11,0
44402085,INIMA BĂRĂGANULUI COOPERATIVĂ AGRICOLĂ,Călăraşi,Călăraşii Vechi,Telefon: 0733802489; ,4621,4146515,5713728,61923,0,18,0
44215729,LIVADA SOARELUI COOPERATIVĂ AGRICOLĂ,Galaţi,Viile,Telefon: 0746043698; Adresa de e-mail: aromafruit.bio@gmail.com; Telefon: 0739949824; ,4631,4104686,1088394,51013,0,5,1
43995618,BIOGRAINS CUZA VODA COOPERATIVĂ AGRICOLĂ,Constanţa,Cuza Vodă,Telefon mobil: 0730106211; Adresa de e-mail: catalinmihai76@gmail.com; ,4621,4082346,3465308,16028,0,5,0
41597969,TĂRÂMURI VERZI COOPERATIVA AGRICOLĂ,Hunedoara,Turdaş,Telefon mobil: 0740906269; Adresa de e-mail: costecu.cornel@yahoo.com; ,0125,4082183,2551154,64156,0,190,2
44376784,CÂMPIA DE VEST A BRĂILEI COOPERATIVĂ AGRICOLĂ,Brăila,Gradistea,,4621,4081872,2411901,150793,0,9,0
48288413,DORILAR COOPERATIVĂ AGRICOLĂ,Olt,Sprâncenata,Telefon: 0765908485; ,4611,4079144,0,27925,0,15,0
47389266,FERMIERUL MUREȘEAN COOPERATIVĂ AGRICOLĂ,Mureş,Bogata,Telefon mobil: 0755584680; ,4621,4066776,0,74271,0,19,0
44369043,DE BANAT COOPERATIVĂ AGRICOLĂ,Timiş,Satchinez,Telefon mobil: 0759547556; ,4631,4049600,884597,127382,0,5,1
44734394,AGRIGRUP CAMBURI COOPERATIVĂ AGRICOLĂ,Tulcea,Sarighiol de Deal,Telefon mobil: 0744650438; ,,4049404,0,23755,0,11,0
37545015,AGROSÎRBI CIOCĂNEŞTI COOPERATIVA AGRICOLĂ,Călăraşi,Ciocăneşti,,4621,3976265,5826355,218196,0,13,0
34384232,COOPERATIVA AGRICOLĂ BANAT ECO FARMS,Arad,Cermei,,0111,3958663,4171840,2078141,0,5,2
44804619,PRODUSE MUNTENEȘTI COOPERATIVĂ AGRICOLĂ,Giurgiu,Falaştoaca,,0111,3954263,4970171,45493,0,58,0
44329251,GRĂDINA NOASTRĂ DIN VOINEȘTI COOPERATIVĂ AGRICOLĂ,Dâmboviţa,Voineşti,,0124,3911392,0,0,844340,7,2
44934511,CAUGAGIA VERDE COOPERATIVĂ AGRICOLĂ,Tulcea,Caugagia,,4621,3910808,6340235,5500,0,15,1
45114943,COOPERATIVA AGRICOLĂ DOBROGEA VERDE,Tulcea,Mineri,,0111,3901818,1337656,20066,0,10,1
47178552,AGROSEM CEREALE COOPERATIVĂ AGRICOLĂ,Satu Mare,Satu Mare,Telefon mobil: 0744792306; ,,3871131,0,45316,0,5,0
43533317,BIOFOOD AGRI COOPERATIVĂ AGRICOLĂ,Bucureşti,Bucureşti Sectorul 2,,1011,3856671,3938120,221843,0,32,0
42540863,LIVEZILE AROMA COOPERATIVĂ AGRICOLĂ,Suceava,Fălticeni,Telefon: 0744543826; ,4631,3839270,2874425,896004,0,7,1
44680014,PRIMPORC HALMEU COOPERATIVĂ AGRICOLĂ,Satu Mare,Satu Mare,Telefon mobil: 0742311833; ,0146,3793982,10899433,237904,0,6,1
44623620,RUSTICUS COOPERATIVĂ AGRICOLĂ,Dâmboviţa,Băleni-Români,Telefon: 0727369566; Adresa de e-mail: bogdan@cibatus.ro; ,4631,3787324,246485,488676,0,91,0
44620063,CERES DOBROGEA COOPERATIVĂ AGRICOLĂ,Constanţa,Adamclisi,Adresa de e-mail: ca.ceresdobrogea@gmail.com; Telefon: 0727758851; ,4621,3781314,10526884,31488,0,16,0
44925769,MAN FARM COOPERATIVĂ AGRICOLĂ,Satu Mare,Carei,Telefon mobil: 0755347075; ,0145,3779344,849880,840876,0,6,3
39384071,CORA GREEN LAND COOPERATIVĂ AGRICOLĂ,Olt,Corabia,,0111,3751560,2617936,0,2153774,16,1
44598390,COOPERATIVA AGRICOLĂ PRATEMPO VIVA,Arad,Vinga,,0111,3750248,1118384,57965,0,5,1
44809390,KOTHAI COOPERATIVĂ AGRICOLĂ,Arad,Semlac,,0111,3681157,2740382,704,0,5,0
45267076,MIRON COSTIN FARMERS COOPERATIVĂ AGRICOLĂ,Neamţ,Miron Costin,,4621,3664310,3751595,9594,0,8,0
48224517,RUNCU AET COOPERATIVĂ AGRICOLĂ,Constanţa,Runcu,Telefon: 0740/234740; ,0111,3653368,0,10177,0,7,0
39798200,CRIŞANA LAND COOPERATIVA AGRICOLĂ,Bihor,Ciumeghiu,,4621,3620258,6057319,152206,0,10,1
44821547,AGRO - CATA COOPERATIVĂ AGRICOLĂ,Covasna,Catalina,,0113,3607002,2078040,203343,0,10,0
45430296,NICOLAE BĂLCESCU COOPERATIVĂ AGRICOLĂ,Călăraşi,Nicolae Bălcescu,,4621,3599368,2396592,80136,0,5,0
45243190,PODIS COSTESTI COOPERATIVĂ AGRICOLĂ,Iaşi,Costeşti,Telefon mobil: 0756083737; ,0111,3592655,0,17390,0,5,0
43135265,GENETICA DIN TRANSILVANIA COOPERATIVĂ AGRICOLĂ,Cluj,Loc. Cluj-Napoca | Municipiul Cluj-Napoca,,0162,3581364,1458245,2463675,0,7,3
45074237,AGRO CHECEANA COOPERATIVĂ AGRICOLĂ,Timiş,Checea,Telefon mobil: 0726213319; ,0111,3550320,720545,7274,0,6,0
40169280,DANCOR ROTUNDA COOPERATIVĂ AGRICOLĂ,Olt,Redea,,4621,3545791,6579977,7850,0,6,0
40781830,ROMFRUCT M&M COOPERATIVĂ AGRICOLĂ,Giurgiu,Uzunu,,0124,3534831,5902249,81101,0,5,0
45363111,ARMONIA MUNTENI BUZĂU COOPERATIVĂ AGRICOLĂ,Ialomiţa,Munteni-Buzău,,4621,3515602,447352,170816,0,21,1
45003660,SMART AGRO BRAND COOPERATIVĂ AGRICOLĂ,Maramureş,Coltirea,Telefon mobil: 0722196060; ,,3498245,0,21203,0,5,0
44916000,FERMIERII BRANULUI COOPERATIVĂ AGRICOLĂ,Braşov,Sohodol,,4611,3491810,160826,10567,0,5,1
41689892,TRANSYLVANIA PREMIUM ANGUS COOPERATIVĂ AGRICOLĂ,Alba,Galda de Jos,,4623,3461625,1984086,9240,0,9,0
42995261,ROAGRO SUPPLY COOPERATIVĂ AGRICOLĂ,Iaşi,Holboca,Telefon mobil: 0735851442; ,0111,3455888,1355967,44612,0,8,0
43756254,COOP CERTEZANUL COOPERATIVĂ AGRICOLĂ,Satu Mare,Halmeu,Telefon mobil: 0748632710; ,0150,3393149,2738483,96332,0,6,1
45202654,AGRO DIVERTIS SĂLAJ COOPERATIVĂ AGRICOLĂ,Sălaj,Valea Pomilor,,0111,3388269,4200,243786,0,6,4
47759741,COOPERATIVA AGRICOLĂ GRĂDINA NOASTRĂ DIN HUȘI,Vaslui,Huşi,,4631,3382060,0,139703,0,5,0
44208128,PROAGRO BONADEA COOPERATIVĂ AGRICOLĂ,Bihor,Valea lui Mihai,Telefon: 0759547556; ,4621,3380472,1403232,261478,0,21,1
44079716,INOTECHAGRO MĂDĂRAŞ COOPERATIVĂ AGRICOLĂ,Bihor,Salonta,Telefon: 0759547556; ,4621,3376176,1283363,6130,0,11,1
39910478,COOPERATIVA AGRICOLĂ ARSIB,Arad,Nădlac,Telefon mobil: 0747699791; ,1011,3364349,2500,346365,0,5,2
44010766,FERMA AGROMAG COOPERATIVĂ AGRICOLĂ,Sibiu,Târnava,Telefon: 0759547556; ,4621,3358429,2830062,62063,0,5,0
25156960,15 FEBRUARIE ROTUNDA COOPERATIVA AGRICOLĂ,Olt,Grozăveşti,Telefon: 0740/378327; Telefon: 0249/542375; ,0111,3354578,270270,40605,0,7,0
47069873,AGROPROD COOP COOPERATIVĂ AGRICOLĂ,Olt,Izbiceni,,4611,3346578,63827,181062,0,6,0
46377298,NOVA TOP BIOPROD COOPERATIVĂ AGRICOLĂ,Giurgiu,Sat Grădiştea | Comuna Comana,,0113,3342306,870899,11831,0,5,9
41844473,UNIREA GOSPODARILOR MIHĂILEŞTI COOPERATIVĂ AGRICOLĂ,Buzău,Mihăileşti,,4639,3311002,3264859,11739,0,5,2
45052212,TODIREŞTI COOPERATIVĂ AGRICOLĂ,Suceava,Părhăuţi,Telefon: 0757643566; ,4621,3260928,1391377,619,0,9,0
45474276,POTATO PROD CV COOPERATIVĂ AGRICOLĂ,Covasna,Moacşa,,0113,3250697,971056,4779,0,5,0
44897235,PROFESIONIȘTII SPICELOR ZIDURI COOPERATIVĂ AGRICOLĂ,Buzău,Costieni,,,3244304,0,2427,0,6,0
48058651,BIO PROD GHEORGHE LAZĂR COOPERATIVĂ AGRICOLĂ,Ialomiţa,Slobozia,Telefon mobil: 0799874443; ,4631,3243959,0,78747,0,7,0
45204930,AGROTER SUD COOPERATIVĂ AGRICOLĂ,Dolj,Terpeziţa,,4621,3243780,929144,0,50170,8,2
40031685,DRUMUL CARTOFULUI COOPERATIVA AGRICOLĂ,Covasna,Turia,Telefon mobil: 0744430321; Adresa de e-mail: drumulcartofuluica@yahoo.com; ,0150,3230206,2962718,9274,0,6,0
39485211,RECOLTA NOUĂ COOPERATIVĂ AGRICOLĂ,Dolj,Craiova,Telefon: 0722625630; ,0111,3221885,4199697,66431,0,8,1
44223233,"COOPERATIVA AGRICOLĂ DE PRODUCȚIE ""ȘTEFAN CEL MARE""",Vaslui,Cănţălăreşti,Telefon mobil: 0756949713; ,4621,3207769,1849738,39049,0,6,2
42832639,AGRICOLA ARDEAL COOPERATIVĂ AGRICOLĂ,Bistriţa-Năsăud,Stupini,Telefon: 0754587295; ,4623,3190690,2027492,95965,0,103,1
47552150,AGROZOOTEHNICA TRAIAN COOPERATIVĂ AGRICOLĂ,Tulcea,Traian,Telefon mobil: 0745257464; ,4633,3184682,0,11476,0,9,0
45178904,“DE PRODUCŢIE DUDEŞTI” COOPERATIVĂ AGRICOLĂ,Brăila,Dudeşti,,0111,3178490,3860445,57549,0,5,1
42191151,VADUL DUNĂRII COOPERATIVĂ AGRICOLĂ,Galaţi,Galaţi,Telefon: 0755863925; ,4621,3149565,1111164,0,14765,30,1
45373026,COOPERATIVA AGRICOLĂ DE GRADUL II GOLĂIEŞTI,Iaşi,Golăieşti,Telefon mobil: 0721402616; Adresa de e-mail: office@kontto.ro; ,0111,3146302,2815366,13209,0,6,0
40227992,AMELIA MARIA AGRO COOPERATIVA AGRICOLĂ,Vaslui,Oraş Murgeni,Telefon mobil: 0745/304018; ,0111,3129889,38672,933,0,12,3
45264975,FERMIERII DIN ZONA DE VEST COOPERATIVĂ AGRICOLĂ,Timiş,Giarmata,,4621,3073885,0,3758,0,15,0
44986189,COOPERATIVA AGRICOLĂ DOBROGEA EST,Tulcea,Turda,,4621,3029913,5932085,81421,0,8,0
43617310,CHIOVEANU AGROCALARASI COOPERATIVĂ AGRICOLĂ,Călăraşi,Vlad Ţepeş,Telefon: 0759547556; ,4621,3025260,13165828,0,13603,9,1
44790980,LUNCA PRUTULUI STĂNILEȘTI COOPERATIVĂ AGRICOLĂ,Vaslui,Stănileşti,,0111,3009027,2054855,18862,0,5,1
43765449,FERMA AGRICOLA ZAU DE CAMPIE COOPERATIVĂ AGRICOLĂ,Mureş,Zau de Cîmpie,,4621,2982642,1098077,103573,0,5,0
39545542,BIRUINŢA OLTENIEI COOPERATIVĂ AGRICOLĂ,Olt,Redea,,4611,2980398,2452364,8565,0,5,2
46651767,AGRO CHIABURU COOPERATIVĂ AGRICOLĂ,Brăila,Tătaru,,0111,2977982,1619446,65265,0,10,3
40029359,BIODANUBIANA COOPERATIVĂ AGRICOLĂ,Ilfov,Oraş Popeşti Leordeni,,,2936539,0,8309,0,16,1
39407167,COOP AGRIJIANU COOPERATIVĂ AGRICOLĂ,Teleorman,Talpa-Ogrăzile,,0111,2935521,5349618,40245,0,7,0
47788585,FELNACANA AGROFARM COOPERATIVĂ AGRICOLĂ,Arad,Felnac,Telefon mobil: 0752863865; ,0111,2921975,0,757,0,5,0
32457222,„SITA NATURAL” COOPERATIVA AGRICOLĂ,Covasna,Sita Buzăului,Telefon mobil: 0749289090; ,4633,2877948,2861135,26160,0,22,2
45238828,AGROASANA VILLAGE COOPERATIVĂ AGRICOLĂ,Brăila,Tichileşti,,4621,2870692,2122724,16832,0,7,0
31289775,COOPERATIVA AGRICOLA LUNCA SOMESULUI MIC,Cluj,Dezmir,Telefon: 0724064125; Telefon: 0751110962; ,4631,2845538,2708200,17883,0,12,1
40218960,AGROFARM TURIA COOPERATIVA AGRICOLĂ,Covasna,Turia,,4631,2831758,2545644,24365,0,7,0
44019250,COOPERATIVA AGRICOLĂ AGRO-OBÂRȘIA,Mehedinţi,Obârşia de Câmp,,0111,2827763,1557873,390513,0,7,0
47996357,TOPRAISAR COOPERATIVĂ AGRICOLĂ,Constanţa,Topraisar,Telefon: 0724828093; ,0111,2818456,0,0,909,9,0
40691215,COOPERATIVA AGRICOLĂ ARGEDAVA NOVACI,Bucureşti,Bucureşti Sectorul 3,,0113,2810295,4787103,8465,0,5,0
48331009,SEBCOOP MOVILA BANULUI COOPERATIVĂ AGRICOLĂ,Buzău,Cioranca,Telefon: 0745898210; Telefon: 074421421028; ,4621,2786564,0,19245,0,5,1
44830618,FERMIERII MICI COVĂSNENI COOPERATIVĂ AGRICOLĂ,Covasna,Bixad,,0113,2775591,911436,12311,0,6,0
46131403,FERMA ARDELEANA COOPERATIVĂ AGRICOLĂ,Cluj,Cojocna,,4631,2729196,1799110,14938,0,5,0
44934716,AGRISTA SUD-EST COOPERATIVĂ AGRICOLĂ,Constanţa,Tariverde,,0111,2716598,4207725,3187,0,7,1
45312592,VIROTAV AGRO GRAINS COOPERATIVĂ AGRICOLĂ,Galaţi,Galaţi,Telefon: 0721411469; Adresa de e-mail: dancsis@yahoo.com; ,0111,2715444,533477,18198,0,5,0
45221303,AGRICOLA HAGIENI COOPERATIVĂ AGRICOLĂ,Ialomiţa,Mihail Kogălniceanu,Telefon mobil: 0724357908; ,4621,2713424,1566947,70152,0,5,0
44331987,LEGO INNOVATION GROUP COOPERATIVĂ AGRICOLĂ,Neamţ,Bodeşti,,4631,2692804,2251381,1969192,0,5,1
45191288,COOPERATIVA AGRICOLA AGROMARK,Bihor,Palota,Telefon: 0745595113; ,,2678368,0,12026,0,6,0
39576832,ORIZONTUL STOICĂNEŞTILOR COOPERATIVĂ AGRICOLĂ,Olt,Stoicăneşti,,4661,2642983,2270654,3779,0,5,1
39819435,AGRODOBRYS COOPERATIVĂ AGRICOLĂ,Dolj,Dobridor,,0161,2636028,2090967,84036,0,183,0
47356315,AGRO UNIVERSAL CRIȘ COOPERATIVĂ AGRICOLĂ,Arad,Chişineu-Criş,,0111,2628280,20131,34748,0,6,0
44484468,COOPERATIVA AGRICOLĂ BIOGARDEN HAMANGIA,Tulcea,Baia,,0111,2615056,2940996,47371,0,63,0
40854240,",,SATUL NOU"" COOPERATIVA AGRICOLĂ",Brăila,Visani,,1071,2608941,2876976,23425,0,8,0
36495555,PRODUS ÎN DÂMBOVIŢA COOPERATIVA AGRICOLĂ,Dâmboviţa,Lunguleţu,,5210,2607159,2937854,0,1433422,5,1
44046255,CREȘTEREA ANIMALELOR PRUNDU COOPERATIVĂ AGRICOLĂ,Giurgiu,Prundu,,0142,2576480,1025926,480798,0,11,2
39235789,AGRICOOP VALEA MORII COOPERATIVĂ AGRICOLĂ,Teleorman,Cucueţi,,0111,2576304,347952,14323,0,6,0
45455720,COOPERATIVA AGRICOLĂ FAMILIALĂ PRODUCĂTOR LEGUME BIO,Giurgiu,Colibaşi,,4611,2569063,178252,181474,0,5,0
44614193,CONCEPT AGRO FARM COOPERATIVĂ AGRICOLĂ,Constanţa,Mihail Kogălniceanu,,0141,2552078,45720,2039481,0,5,1
45005296,LTJ AGRO COOPERATIVĂ AGRICOLĂ,Covasna,Târgu Secuiesc,,4631,2530624,1642348,12229,0,5,0
35479250,KÉZDI LACTO COOP  COOPERATIVA AGRICOLĂ,Covasna,Ojdula,Telefon mobil: 0768402329; Telefon mobil: 0726147696; Telefon mobil: 0728144201; ,4633,2521798,3634435,3781,0,75,4
39213667,AGRICOOP OBŞTEA COOPERATIVĂ AGRICOLĂ,Teleorman,Băcăleşti,,0111,2515255,2924962,0,151269,5,0
44514615,COOPERATIVA AGRICOLĂ ECOAGRI DAIMA,Tulcea,Ceamurlia de Sus,,0111,2509375,3411480,114540,0,11,0
35482190,COOPERATIVA AGRICOLA LEGUME BELINT,Timiş,Belinţ,Telefon mobil: 0744534705; ,4631,2498960,2183294,3385,0,9,1
40340036,IZVORUL FIZEŞULUI COOPERATIVĂ AGRICOLĂ,Cluj,Cătina,,4621,2487054,3644589,73482,0,9,1
40276421,CARTOFUL DE CERNAT COOPERATIVA AGRICOLĂ,Covasna,Cernat,,4631,2472546,1455804,55387,0,5,1
43822676,VALEA TARNAVELOR COOPERATIVĂ AGRICOLĂ,Alba,Cetatea de Baltă,,4621,2471621,2358857,14450,0,12,0
44557543,COOPERATIVA AGRICOLĂ AGRIFARM GRIVITA,Ialomiţa,Griviţa,Telefon mobil: 0768535779; Adresa de e-mail: adrian.vladu@cristofor.ro; ,0111,2471061,2824729,18723,0,22,1
44960839,AGROCERES FARM COOPERATIVĂ AGRICOLĂ,Olt,Bălăneşti,,4611,2461933,930336,0,2147,5,0
42311983,BĂLUCANA COOPERATIVĂ AGRICOLĂ,Arad,Bocsig,,4621,2461562,375318,67562,0,6,0
40037297,COLINELE JIBERTULUI COOPERATIVĂ AGRICOLĂ,Braşov,Lovnic,,4633,2448858,2184937,226849,0,37,4
42616031,COOPERATIVA AGRICOLĂ VALEA SABARULUI COOPERATIVĂ AGRICOLĂ,Giurgiu,Valea Dragului,,4621,2435897,1961422,0,75554,6,0
45206680,OVIS SUIN CAUAS COOPERATIVĂ AGRICOLĂ,Satu Mare,Căuaş,,4621,2428867,1880901,40799,0,6,1
20167985,COOPERATIVA AGRICOLĂ  GRUP DE PRODUCĂTORI FRUTIS VOINEŞTI COOPERATIVĂ AGRICOLĂ,Dâmboviţa,Voineşti,Telefon: 0723365957; Telefon: 0245679325; ,4631,2424735,689577,247990,0,9,1
41446087,BIOMEAT TRANSILVANIA COOPERATIVĂ AGRICOLĂ,Mureş,Saschiz,,4632,2391234,3489490,375181,0,10,3
42260537,COOPERATIVA AGRICOLĂ DE PRODUCŢIE DROBETA,Mehedinţi,Şovarna,,4621,2388552,8561318,25770,0,5,1
43410667,ȚARA CĂLATEI COOPERATIVĂ AGRICOLĂ,Cluj,Călăţele,,4633,2373443,891680,183160,0,21,1
48444148,DOBROGEA PLOPU COOPERATIVĂ AGRICOLĂ,Tulcea,Tulcea,,4621,2323745,0,5031,0,6,0
37513536,ORGANIC GREEN COOPERATIVĂ AGRICOLĂ,Argeş,Negraşi,,0111,2305952,3419889,14537,0,7,1
34922366,COOPERATIVA AGRICOLĂ PRODUCŢIA SALONTANĂ,Bihor,Salonta,,4621,2295582,1237343,470177,0,13,1
47219377,COOPERATIVA AGRICOLA POEANA,Prahova,Ologeni,,,2281609,0,254184,0,6,0
39670740,AGRILEDAS GRECI COOPERATIVĂ AGRICOLĂ,Tulcea,Greci,,0111,2268205,2847447,4255,0,8,1
26724368,FERMIERUL VLĂSINEŞTEAN COOPERATIVA AGRICOLĂ,Botoşani,Vlăsineşti,Telefon: 0744/666654; Adresa de e-mail: primariavlasineşti@yahoo.com; ,0150,2257105,1922152,715,0,5,2
44823351,FERMELE BIO BOBOTA COOPERATIVĂ AGRICOLĂ,Sălaj,Bobota,,,2250393,0,0,70540,6,0
38016381,COOPERATIVA AGRICOLA TRANSILVANIA COOPERATIVA AGRICOLĂ,Cluj,Gherla,Telefon: 0744494016; ,0162,2246814,1929762,24839,0,7,10
44929027,AGRO CARERA COOPERATIVĂ AGRICOLĂ,Covasna,Turia,,4631,2235635,757707,117041,0,5,0
48234090,SMART CROPS COOPERATIVĂ AGRICOLĂ,Bacău,Sascut,,4621,2231495,0,5933,0,5,0
44813323,CARTOFUL FERMECAT COOPERATIVĂ AGRICOLĂ,Covasna,Sânzieni,,4631,2212161,2722001,21711,0,5,0
39963812,NUCUL DE AUR COOPERATIVĂ AGRICOLĂ,Suceava,Suceava,Telefon mobil: 0740243913; ,4621,2196891,2893958,92243,0,5,1
47153760,AGRO GABRIELA COOPERATIVĂ AGRICOLĂ,Ialomiţa,Borduşani,Telefon mobil: 0735223938; ,,2190928,0,2949,0,7,0
45285722,ECO IAIA DAN COOPERATIVĂ AGRICOLĂ,Tulcea,Sabangia,,0113,2183172,779543,627334,0,5,2
40730039,COOP TRADE LUNGULEŢU COOPERATIVĂ AGRICOLĂ,Dâmboviţa,Lunguleţu,Telefon mobil: 0730816476; ,4631,2177254,1746104,1840,0,6,0
39354828,TOCEA IANCA COOPERATIVĂ AGRICOLĂ,Olt,Ianca,,0111,2166981,1518085,7573,0,16,0
45271166,AGRI-ZOO NUFĂRU COOPERATIVĂ AGRICOLĂ,Tulcea,Nufăru,,4621,2139139,741370,107147,0,5,0
44219640,ECOCARPATHIAN COOPERATIVĂ AGRICOLĂ,Prahova,Urleta,Telefon: 0745 257 464; Adresa de e-mail: dragosal@yahoo.com; ,4631,2127125,2012583,5172,0,7,0
45253836,COOPERATIVA AGRICOLĂ PROAGROSEM,Bihor,Diosig,Telefon: 0723664491; ,,2123365,0,1592,0,6,1
28403798,PRELUCRAREA ŞI VALORIFICAREA LAPTELUI TROTUŞ COOPERATIVA AGRICOLĂ,Harghita,Lunca de Jos,Telefon: 0266371513; Fax: 0266371513; Telefon mobil: 0726514699; Telefon mobil: 0725516248; Adresa de e-mail: gyimesmilch@gmail.com; ,1051,2117287,2348931,356991,0,87,16
39361760,AGRO ALIVIC FARM COOPERATIVĂ AGRICOLĂ,Vrancea,Slobozia Ciorăşti,Telefon: 0768356063; ,0111,2109103,954660,0,7330,10,0
45020733,COOPERATIVA AGRICOLĂ BANAT JUNIOR,Timiş,Timişoara,Telefon mobil: 0760054648; ,4621,2106733,0,36931,0,7,1
39881186,SOPA MARPOD COOPERATIVA AGRICOLĂ,Sibiu,Ilimbav,,1011,2104640,1857360,33050,0,9,2
39667752,AGROSUD GRĂDINILE 2018 COOPERATIVĂ AGRICOLĂ,Olt,Arvăteasca,,4611,2099736,1736413,0,150173,5,4
44965143,GERIAL COOP 2021 COOPERATIVĂ AGRICOLĂ,Ialomiţa,Traian,Telefon mobil: 0765898350; ,4621,2089270,3018264,8402,0,5,0
42780653,AGROBIM BM COOPERATIVĂ AGRICOLĂ,Dolj,Malu Mare,,0111,2056977,479318,8724,0,6,1
47317537,VINTILEANCA 1999 COOPERATIVĂ AGRICOLĂ,Buzău,Vintileanca,Adresa de e-mail: sdbagrodistrib@gmail.com; Telefon: 0725083581; ,4621,2051926,6500,13526,0,10,0
44869537,AGRICOOP TÂRNAVELE NOI COOPERATIVĂ AGRICOLĂ,Teleorman,Târnava,,4621,2048676,1117096,3457,0,6,0
45289660,AGROALFADIT COOPERATIVĂ AGRICOLĂ,Harghita,Joseni,Telefon mobil: 0745168299; ,4633,2035590,599855,14532,0,12,0
44713405,COOPERATIVA AGRICOLĂ AGRO BAŞCHIOI,Tulcea,Nicolae Bălcescu,,0111,2027728,1872288,9720,0,6,0
43637245,AGRO VALEA LARGA COOPERATIVĂ AGRICOLĂ,Mureş,Valea Largă,,4621,2019338,4466005,0,455503,5,0
45053196,SPITZ COOPERATIVĂ AGRICOLĂ,Satu Mare,Carei,,0147,2018812,423800,27635,0,5,1
44001733,AGRO SALI OMURCEA COOPERATIVĂ AGRICOLĂ,Constanţa,Valu lui Traian,Telefon mobil: 0722322378; ,0111,2004174,2605862,0,18703,5,1
44411040,SEMINTE BARAGAN COOPERATIVĂ AGRICOLĂ,Călăraşi,Fundulea,Telefon: 0722156177; ,4621,1995840,2196606,346729,0,7,0
43875646,TERRA PROD COOPERATIVĂ AGRICOLĂ,Argeş,Bradu,Telefon: 0759547556; ,4621,1994361,2130225,1866,0,9,0
40395759,CÂMPIA DE SUD COOPERATIVĂ AGRICOLĂ,Giurgiu,Pietrişu,Telefon: 0763846087; ,5210,1986617,1585773,26600,0,6,0
44179430,BAZINUL POMICOL REGHIN- BATOȘ COOPERATIVĂ AGRICOLĂ,Mureş,Reghin,,0124,1972938,0,118407,0,5,0
40120430,FERMIERUL MOROŞAN COOPERATIVĂ AGRICOLĂ,Maramureş,Cerneşti,,0113,1972611,0,194600,0,6,15
44207661,COOPERATIVA AGRICOLĂ PROXIMA CEREAL,Tulcea,Tulcea,,4621,1960412,1201069,37809,0,6,1
19737144,COOPERATIVA AGRICOLĂ - POMICULTORUL DÂMBOVIŢEAN COOPERATIVĂ AGRICOLĂ,Dâmboviţa,Drăgăeşti Ungureni,Telefon: 0744382170; Telefon: 0766686738; ,0125,1951847,1654998,88057,0,6,3
31132532,LEGUME DE VIDRA COOPERATIVA AGRICOLĂ,Ilfov,Creţeşti,,4799,1947437,1768850,15481,0,12,2
47899494,ECOSYSTEM FACTORY COOPERATIVĂ AGRICOLĂ,Constanţa,Cobadin,Telefon mobil: 0761891891; ,4621,1934622,0,26145,0,6,0
47017025,ANA COOP GALCAAGRI COOPERATIVĂ AGRICOLĂ,Brăila,Zăvoaia,,0111,1921648,0,2619,0,5,0
44574722,AGRICOOP AGRICULTURA COOPERATIVĂ AGRICOLĂ,Teleorman,Fântânele,,4621,1912554,871507,9215,0,7,0
37104116,MIORIȚA OACHEȘE COOPERATIVA AGRICOLĂ,Alba,Săsciori,,0162,1902445,2229152,26660,0,13,1
35853442,GRUPUL DE PRODUCATORI POIANA PASCULUI COOPERATIVA AGRICOLĂ,Bistriţa-Năsăud,Lunca,,4633,1900864,1393733,11616,0,35,2
39583821,OLTENIA TINERILOR FERMIERI COOPERATIVĂ AGRICOLĂ,Dolj,Dăbuleni,,4611,1897421,1302513,0,501782,5,4
39564730,GROJDAGRO COOPERATIVĂ AGRICOLĂ,Olt,Grojdibodu,,0142,1896116,209739,1383,0,10,0
45409910,ADEX BIOAGRO COOPERATIVĂ AGRICOLĂ,Maramureş,Baia Mare,,4621,1891207,2766088,131951,0,5,0
39451758,ROMANATI SUD COOPERATIVA AGRICOLĂ,Dolj,Amărăştii de Sus,Telefon: 0722673105; ,4611,1861637,2360287,54269,0,5,2
39639418,COOPERATIVA AGRICOLĂ DE GRADUL II AGROSFERA,Suceava,Muşeniţa,Telefon mobil: 0733180525; ,4621,1858130,3372084,12709,0,6,1
45418403,OGOARELE MUNTENIEI COOPERATIVĂ AGRICOLĂ,Călăraşi,Olteniţa,Telefon: 0721224990; ,4621,1854565,3621364,89030,0,16,0
41408202,FERMA AGRO DOBROGEANA 2019 COOPERATIVĂ AGRICOLĂ,Constanţa,Mihail Kogălniceanu,,0161,1854423,2854718,14733,0,5,1
44703827,COOPERATIVA AGRICOLĂ DE GRADUL II CULTURI RODITOARE,Vaslui,Unteşti,Telefon mobil: 0749/312345; ,4621,1853247,1382387,7033,0,8,0
45288915,UAP VASLUI COOPERATIVĂ AGRICOLĂ,Vaslui,Valea Târgului,Telefon mobil: 0743/035090; ,,1851181,0,0,328,5,0
44667562,BIO GRINDAŞI COOPERATIVĂ AGRICOLĂ,Ialomiţa,Grindaşi,Telefon mobil: 0765501826; ,4621,1848534,2539300,0,35084,8,1
43766380,SEACA DE PADURE INVEST COOPERATIVĂ AGRICOLĂ,Dolj,Seaca de Pădure,Telefon: 0752312993; ,0111,1843061,1386535,6025,0,6,0
45155676,VIITORUL VIŞANI COOPERATIVĂ AGRICOLĂ,Brăila,Visani,,0111,1819608,2110222,9789,0,6,0
39761490,SOMEŞ CODRU COOPERATIVĂ AGRICOLĂ,Maramureş,Rodina,,4633,1817456,1769663,24379,0,18,2
39135844,PRODUCT COMPACT FARMS COOPERATIVA AGRICOLĂ,Olt,Stoicăneşti,,0111,1789229,1484417,30570,0,29,1
39405700,HDMMA STAR LAND COOPERATIVĂ AGRICOLĂ,Olt,Oraş Potcoava,,4611,1788749,0,2133,0,5,0
41248926,ANGUS SUD-OLTENIA COOPERATIVĂ AGRICOLĂ,Argeş,Bascov,,4632,1787945,1364614,26684,0,5,2
39270662,SATUL REZISTA COOPERATIVA AGRICOLĂ,Galaţi,Slobozia Blăneasa,,0161,1726741,1334478,0,67687,8,1
39472920,AGROSUD ROMANAŢI COOPERATIVĂ AGRICOLĂ,Olt,Caracal,,4611,1726191,747741,0,68663,5,1
32098200,COSAL AGROINVEST GROUP  COOPERATIVA AGRICOLĂ,Botoşani,Dorohoi,,4621,1714484,2374044,11886,0,5,1
44481992,COOPERATIVA AGRICOLĂ DE GRADUL II NOROC,Iaşi,Răducăneni,Telefon: 0232741005; Adresa de e-mail: avocat@anarata.ro; ,0150,1703520,0,3739,0,8,0
45350723,NEUER SAMSTAG BIO COOPERATIVĂ AGRICOLĂ,Constanţa,Constanţa,Telefon mobil: 0744516121; ,4621,1702209,1055749,10295,0,5,0
44215222,BORANGICU PANGAL COOPERATIVĂ AGRICOLĂ,Giurgiu,Mihăileşti,,0111,1689725,4958368,1144,0,5,0
42987927,ABATORUL DORIPESCO PENTRU PROCESAREA CARNII COOPERATIVĂ AGRICOLĂ,Braşov,Crizbav,Telefon: 0268481581; Telefon: 0268481682; ,4611,1687050,12000,202791,0,6,1
43534274,NUCII COOPERATIVĂ AGRICOLĂ,Bucureşti,Bucureşti Sectorul 3,Telefon: 0759547556; ,,1648044,0,0,1180,6,0
44412798,COOPERATIVA AGRICOLĂ SPICUL TOPOLOG,Tulcea,Topolog,,0111,1638013,316384,14113,0,12,1
44055270,COOPERATIVA AGRICOLĂ WSM SARIGHIOL,Tulcea,Sarighiol de Deal,,4621,1633951,2641073,5842,0,10,0
45033830,AGRO T.G.S. COOPERATIVĂ AGRICOLĂ,Covasna,Târgu Secuiesc,,0113,1631609,1173187,250214,0,5,1
36550587,SCHONTAL INNOVATIVE COOPERATIVA AGRICOLĂ,Satu Mare,Urziceni,Telefon mobil: 0740719146; ,0142,1625877,1390110,35911,0,22,11
39897646,PIONIERUL DOBÎRCENI COOPERATIVĂ AGRICOLĂ,Botoşani,Dobârceni,Telefon mobil: 0766234932; ,0111,1624967,2164296,55854,0,9,6
39444483,FLORI DE MAI COOPERATIVĂ AGRICOLĂ,Dolj,Craiova,Telefon: 0746241788; ,0111,1624839,2141329,0,131956,9,0
40278988,COOPERATIVA AGRICOLĂ DOUĂ SATE DOUĂ JUDEŢE,Cluj,Cluj-Napoca,Telefon: 0740014469; ,0111,1624002,1110051,11208,0,6,2
44845937,FERME SECUIEȘTI COOPERATIVĂ AGRICOLĂ,Covasna,Sfântu Gheorghe,,4631,1621407,297207,90094,0,5,0
45286604,COOPERATIVA AGRICOLĂ TOP-YOUNG DEVELOPEMENT,Tulcea,Agighiol,,0111,1618414,1189935,116484,0,7,0
41676981,KARLSBURG COOPERATIVA AGRICOLĂ,Alba,Alba Iulia,,0111,1618089,9187878,0,2729689,8,4
44784104,LEGUME JA - NA COOPERATIVĂ AGRICOLĂ,Covasna,Lunga,,0113,1614284,1303176,42637,0,6,0
44709625,AGROCULTIVO COOPERATIVĂ AGRICOLĂ,Covasna,Cernat,,4631,1608499,1225260,26982,0,5,0
47818465,VALAHIA ZĂRNEȘTI COOPERATIVĂ AGRICOLĂ,Buzău,Zărneşti,Adresa de e-mail: voicilaauto@gmail.com; Telefon: 0726177850; ,4621,1607394,0,28832,0,7,0
39700786,COOPERATIVA AGRICOLĂ JABAR,Timiş,Jabăr,,0111,1598758,1423604,17973,0,5,1
41282545,CARPATICA GHIMEŞ COOPERATIVĂ AGRICOLĂ,Bacău,Tărhăuşi,Telefon mobil: 0769066810; Adresa de e-mail: carpaticaghimes@gmail.com; ,0150,1592498,851189,4298,0,33,4
44451460,AGRICOOP MARIVLAD COOPERATIVĂ AGRICOLĂ,Teleorman,Lisa,,4621,1591177,1077081,5405,0,6,0
44497182,LUCI-AGRO-MOŢĂŢEI COOPERATIVĂ AGRICOLĂ,Dolj,Moţăţei,,,1580728,0,43038,0,10,0
42967652,ECOBILBOR COOPERATIVĂ AGRICOLĂ,Harghita,Bilbor,,4633,1579231,1463633,0,15952,19,3
48360659,GRADINA NOASTRA DIN OSTROV COOPERATIVĂ AGRICOLĂ,Constanţa,Ostrov,Telefon mobil: 0744369008; ,4631,1579037,0,82801,0,5,1
