39576840,BOBUL DE ROMANAŢI COOPERATIVĂ AGRICOLĂ,Olt,Dobrosloveni,,0111,1568882,1647718,0,520679,5,0
39866933,MOSTISTEA GRAIN COOPERATIVĂ AGRICOLĂ,Călăraşi,Fundulea,Telefon mobil: 0722694300; ,4621,1551560,2769038,22069,0,7,1
44062692,TRUPOST COOPERATIVĂ AGRICOLĂ,Brăila,Corbu Nou,,0111,1551291,920913,14005,0,5,2
42429653,BO-COV MEAT COOPERATIVĂ AGRICOLĂ,Covasna,Sfântu Gheorghe,Telefon mobil: 0728289201; ,0142,1547444,637521,124330,0,5,3
44794019,COLINE AURII COOPERATIVĂ AGRICOLĂ,Cluj,Cămăraşu,,,1543004,0,12637,0,8,0
45238887,COOPERATIVA AGRICOLĂ DE SERVICII ROȘIEȘTI,Vaslui,Idrici,,0111,1534415,539824,446272,0,5,0
44816303,AGRO LUNCA MUREȘULUI COOPERATIVĂ AGRICOLĂ,Hunedoara,Folt,,0111,1525355,536395,6334,0,5,0
49232330,CURCANUL DE LA ȚARĂ COOPERATIVĂ AGRICOLĂ,Braşov,Cărpinis,Telefon: 0722475534; ,4611,1525112,0,573,0,5,0
29217890,AGRO TEST DUROC COOPERATIVĂ AGRICOLĂ,Buzău,Movila Oii,,0146,1522662,1488723,33254,0,5,1
42539338,AFIN DE LA MUNTE COOPERATIVĂ AGRICOLĂ,Hunedoara,Căstău,,4631,1511576,1158965,33559,0,6,0
37182963,COOPERATIVA AGRICOLĂ CÂMPIA TRANSILVANIEI,Mureş,Craieşti,Telefon: 0745307035; ,0111,1504589,2693201,7988,0,12,2
44875113,AGROCOOL COOPERATIVĂ AGRICOLĂ,Covasna,Târgu Secuiesc,,4631,1501380,665394,12366,0,6,1
44469867,AGRO TĂTARU COOPERATIVĂ AGRICOLĂ,Constanţa,Tătaru,,4621,1488795,11696777,22569,0,6,0
44917618,TEAM AGRO IASI COOPERATIVĂ AGRICOLĂ,Iaşi,Târgu Frumos,Telefon mobil: 0746821417; Adresa de e-mail: floricidaniel@yahoo.com; ,4621,1481213,70753,11466,0,6,0
43934858,RAMNICU DE JOS COOPERATIVĂ AGRICOLĂ,Constanţa,Râmnicu de Jos,,4621,1480347,3370888,78476,0,6,0
42222673,VALEA SIRETULUI VORONA COOPERATIVĂ AGRICOLĂ,Botoşani,Joldeşti,Telefon mobil: 0764557828; ,0150,1458673,1555100,0,18147,5,0
39639400,CAȘCAȘARU DORNEI COOPERATIVĂ AGRICOLĂ,Suceava,Neagra Şarului,Telefon mobil: 0749254514; Adresa de e-mail: coop.cascasaru@gmail.com; ,,1449646,0,17687,0,105,1
45126980,FERMIERUL ARDELEAN COOPERATIVĂ AGRICOLĂ,Covasna,Zăbala,,4623,1449139,541959,44,0,5,0
39622963,COOPERATIVA AGRICOLĂ A FERMIERILOR LACTOVEST VARIAŞ,Arad,Variaşu Mare,Telefon mobil: 0740034293; ,4633,1447809,595625,50198,0,7,7
44250696,AGROMODRUZENI COOPERATIVĂ AGRICOLĂ,Vrancea,Modruzeni,Telefon mobil: 0763590466; ,4621,1446238,539646,1177,0,10,1
44411318,PARTIUMGRAINS COOPERATIVĂ AGRICOLĂ,Satu Mare,Sărăuad,Telefon mobil: 0744789397; ,0111,1446190,1399696,18745,0,5,0
46947925,VLAȘCA PROD 2022 COOPERATIVĂ AGRICOLĂ,Teleorman,Drăgăneşti-Vlaşca,,,1443728,0,20370,0,11,7
43362438,FRUCTI FLORA CIUMBRUD COOPERATIVĂ AGRICOLĂ,Alba,Ciumbrud,,4622,1439522,1037333,122854,0,5,1
44681397,AGRO - AITA COOPERATIVĂ AGRICOLĂ,Covasna,Aita Mare,,0150,1430163,896228,0,5432,6,2
39028414,ROMANAŢIUL URZICA COOPERATIVA AGRICOLĂ,Olt,Urzica,,4631,1388483,2804607,2815,0,10,1
38960826,TINUTUL SIPOTELOR COOPERATIVA AGRICOLĂ,Galaţi,Ţepu,Telefon: 0733963456; ,4621,1383864,1856659,12361,0,10,1
39512316,SPICUL VIŞINARII COOPERATIVĂ AGRICOLĂ,Olt,Vişina,,4611,1382444,0,0,1110693,6,1
44935576,CSISZERFARM COOPERATIVĂ AGRICOLĂ,Covasna,Albiş,,4631,1380315,868460,12831,0,5,1
44650854,LICU BIO PRODUCT COOPERATIVĂ AGRICOLĂ,Cluj,Frata,,0111,1379051,4188916,69770,0,5,1
44521604,AGRO CEREAL MUNTENIA COOPERATIVĂ AGRICOLĂ,Teleorman,Conţeşti,,4621,1362555,1604602,0,70043,5,0
46879790,AGROZOOTEHNICA SOMEȘANA COOPERATIVĂ AGRICOLĂ,Satu Mare,Mărtineşti,,4633,1352914,0,6139,0,10,0
44827710,AGRO MIHAI LAZURI COOPERATIVĂ AGRICOLĂ,Satu Mare,Lazuri,,0111,1342216,1955584,16761,0,6,1
42091748,OVISIB 2019 COOPERATIVĂ AGRICOLĂ,Sibiu,Răşinari,,0145,1324823,2575132,34384,0,12,0
44685380,DAB CROPS COOPERATIVĂ AGRICOLĂ,Teleorman,Alexandria,,4611,1324677,2590539,5052,0,7,0
45077853,SATE UNION COOPERATIVĂ AGRICOLĂ,Olt,Obârşia,,4611,1324037,882433,11976,0,21,0
45225534,OLTENIA AGRO INVEST COOPERATIVĂ AGRICOLĂ,Dolj,Bogea,,0111,1314385,1317429,34149,0,23,1
34448042,APIS MELLIFERA ALBINA BUZOIANĂ  COOPERATIVA AGRICOLĂ,Buzău,Buzău,Telefon: 0766715439; ,4639,1294655,1833505,1031,0,9,2
40644817,ROM OVIS COOPERATIVĂ AGRICOLĂ,Sibiu,Răşinari,,0145,1285605,1392801,0,15490,11,0
39492030,TINERII FERMIERI DUDESTII NOI COOPERATIVA AGRICOLĂ,Timiş,Dudeştii Noi,,0111,1283247,1536498,0,1463866,8,6
46677643,AGRO FIELD MUNTENIA NORD COOPERATIVĂ AGRICOLĂ,Olt,Optăşani,,,1278150,0,0,62099,5,1
39769388,SADOVEANU COOPERATIVA AGRICOLĂ,Iaşi,Rediu,,0111,1273425,3024213,0,1260871,7,1
43514625,BUCOVINEŞTI COOPERATIVĂ AGRICOLĂ,Suceava,Moldoviţa,,0141,1272968,1191893,80908,0,14,3
44870809,AGRICOM MOROMEȚII COOPERATIVĂ AGRICOLĂ,Teleorman,Talpa-Bâscoveni,,4621,1268068,0,5972,0,5,0
45278016,SPORUL AGROLEG COOPERATIVĂ AGRICOLĂ,Tulcea,Sarichioi,Telefon mobil: 0742004739; ,,1261838,0,4013,0,7,0
45123607,DRAGON AGRO COOPERATIVĂ AGRICOLĂ,Constanţa,Negureni,Telefon mobil: 0745035205; ,,1243428,0,0,1200,6,0
44520226,LEGUME MATCA COOPERATIVĂ AGRICOLĂ,Galaţi,Matca,Telefon: 0759547556; ,4631,1242733,851697,2400,0,5,0
39393592,AGRO BLAHNITA COOPERATIVĂ AGRICOLĂ,Timiş,Cherestur,,0111,1238688,1353274,22118,0,5,0
45106436,AGROPROD CEREAL COOPERATIVĂ AGRICOLĂ,Dolj,Bârca,,4621,1234607,2142671,13399,0,7,0
44685020,COOPERATIVA AGRICOLĂ SITRUN,Brăila,Silistraru,,0111,1231778,1545081,35756,0,13,0
39651861,COOPERATIVA AGRICOLĂ IGRIȘ 2018,Timiş,Igriş,Telefon mobil: 0729531814; ,0111,1224031,0,5721,0,5,0
44658980,COOPERATIVA AGRICOLĂ ECOMOMA,Arad,Dezna,Telefon mobil: 0723448201; ,0147,1218493,444394,316179,0,20,0
44965739,CETATEA BĂNIA UNITĂ COOPERATIVĂ AGRICOLĂ,Dolj,Pieleşti,Adresa de e-mail: N_VALI2003@YAHOO.COM; ,,1210967,0,55700,0,24,0
39586909,BITER ADUCT COOPERATIVA AGRICOLĂ,Dolj,Moţăţei,,0111,1205445,0,52009,0,6,1
36569857,BIO CĂTINA COOPERATIVA AGRICOLĂ,Bucureşti,Bucureşti Sectorul 3,,4631,1192005,1363379,111786,0,5,6
39979703,COOPERATIVA AGRICOLĂ CARTOFUL DE ZĂBALA,Covasna,Zăbala,,4631,1190927,2280350,46378,0,5,0
40752711,GRUP AGRO AMĂRĂȘTII DE JOS COOPERATIVA AGRICOLĂ,Dolj,Amărăştii de Jos,Telefon: 0788000550; ,4621,1182815,1594687,26094,0,5,0
35325005,COOPERATIVA AGRICOLĂ LIVEZILE FĂLTICENI,Suceava,Rădăşeni,Telefon mobil: 0743137259; ,4631,1174442,216917,17645,0,6,1
42485505,MAN PORTITA COOPERATIVĂ AGRICOLĂ,Satu Mare,Portiţa,Telefon mobil: 0740198415; ,0111,1173545,1762632,0,590649,6,0
37718990,RODAGRIA PRODUCE COOPERATIVA AGRICOLĂ,Călăraşi,Ogoru,,4631,1171789,1354638,0,360619,6,1
42699290,GRUP DE PRODUCĂTORI DEALURILE ŞIEUŢULUI COOPERATIVĂ AGRICOLĂ,Bistriţa-Năsăud,Sieut,,4633,1165417,1239438,0,2075,48,1
43621702,VALEA CIOSURI COOPERATIVĂ AGRICOLĂ,Mureş,Sînpetru de Cîmpie,Telefon mobil: 0759547556; ,4621,1163858,1860352,0,18834,13,0
44505005,AGRO CEREALE TSG COOPERATIVĂ AGRICOLĂ,Ialomiţa,Fierbinţii de Jos,Telefon mobil: 0765534818; ,4621,1160704,3750330,14074,0,5,0
44841307,COOPERATIVA AGRICOLĂ BAN AGRIVEST,Bihor,Cheşa,,,1159863,0,42846,0,10,0
39823061,GABRIELLA AVI COOPERATIVĂ AGRICOLĂ,Călăraşi,Ştefan Vodă,,0147,1145133,2986417,0,36065,5,1
43316776,COOPERATIVA AGRICOLĂ BIOCOOP ŞTEFAN CEL MARE,Călăraşi,Ştefan cel Mare,Telefon: 0727366441; ,4621,1141364,8855679,68831,0,6,1
40358785,SIBIOARA COMCEREAL COOPERATIVA AGRICOLĂ,Constanţa,Sibioara,Telefon mobil: 0721092546; ,4621,1133904,752210,0,1168,5,1
39111578,DACIA UNITĂ COOPERATIVĂ AGRICOLĂ,Vrancea,Focşani,,4711,1124051,724339,0,124010,9,2
20781461,GRUP DE PRODUCĂTORI PROLEG SLOBOZIA MOARĂ COOPERATIVĂ AGRICOLĂ,Dâmboviţa,Slobozia Moara,Telefon: 0740249858; Telefon: 0245724007; ,0111,1123221,1181755,29687,0,5,0
45365856,ZONA PERKO COOPERATIVĂ AGRICOLĂ,Covasna,Sânzieni,,0113,1120105,508269,13760,0,5,0
45109670,PETRINVEST AGRO COOPERATIVĂ AGRICOLĂ,Tulcea,Casimcea,,0111,1114009,0,3823,0,5,0
39841319,CARACOSTEA PALAZU MIC COOPERATIVA AGRICOLĂ,Constanţa,Palazu Mic,,4621,1112653,1619467,3642606,0,16,2
39139390,RENAŞTEREA CULTURILOR COOPERATIVA AGRICOLĂ,Arad,Nădab,Telefon: 0751334070; ,0111,1106695,1559635,119436,0,6,1
42287648,COOPERATIVA AGRICOLĂ DĂRMĂNEŞTI,Suceava,Suceava,Telefon mobil: 0744774112; ,4631,1103854,396849,4314,0,5,0
41621501,PÂRTEŞTEANCA COOPERATIVA AGRICOLĂ,Suceava,Pîrteştii de Sus,,4633,1099237,933615,37126,0,5,1
41360309,LIVE FRESH&GREEN COOPERATIVĂ AGRICOLĂ,Giurgiu,Câmpurelu,,4631,1089887,2761096,0,253869,6,3
44557055,VALEA SIL-ARGOVEI COOPERATIVĂ AGRICOLĂ,Călăraşi,Siliştea,Telefon: 0745257464; Adresa de e-mail: dragosal@yahoo.com; ,4621,1083364,3294615,0,55,6,0
44619476,AGRY PRODUCT TRITICUM COOPERATIVĂ AGRICOLĂ,Cluj,Bădeni,,0111,1082929,0,14312,0,5,1
44945286,AGRICER INVEST COOPERATIVĂ AGRICOLĂ,Vrancea,Gugeşti,,4621,1074771,303843,4119,0,12,0
42921051,TERRALEG PERISORU COOPERATIVĂ AGRICOLĂ,Călăraşi,Călăraşi,Telefon: 0721246996; ,4631,1067500,0,22838,0,5,0
44493466,COOPERATIVA AGRICOLĂ DE GRADUL 1 AGRICOG,Iaşi,Horleşti,Telefon mobil: 0767167740; ,4621,1067102,859600,0,1032,5,0
41871486,LEGUME FRUCTE ROŞIORI DE IALOMIŢA COOPERATIVĂ AGRICOLĂ,Ialomiţa,Roşiori,Telefon mobil: 0786521122; ,4631,1058633,440904,58882,0,6,0
32689370,COOPERATIVA AGRICOLĂ ECOAGRAR BIHOR,Bihor,Oşorhei,Telefon: 0259434454; ,,1055591,260018,2409,0,5,0
45704936,MĂRUL AUTENTIC VOINEŞTI COOPERATIVĂ AGRICOLĂ,Dâmboviţa,Gemenea Brătuleşti,,4631,1055160,0,23224,0,5,0
44937658,AGRI BEST CROPS COOPERATIVĂ AGRICOLĂ,Galaţi,Vânători,,4631,1049789,956355,106461,0,6,1
45229773,AGRO BIO -BULL COOPERATIVĂ AGRICOLĂ,Covasna,Căpeni,,0150,1044000,1350,485,0,7,0
44921856,BRAȚUL AGRO PAVEL COOPERATIVĂ AGRICOLĂ,Teleorman,Seaca,,0111,1043908,199288,3484,0,6,0
39899272,PCO VALEA DUNĂRII COOPERATIVĂ AGRICOLĂ,Dolj,Măceşu de Jos,Telefon: 0766250473; ,0161,1039427,312593,26036,0,7,0
41951194,LEGUME FRUCTE GURA IALOMITEI COOPERATIVĂ AGRICOLĂ,Ialomiţa,Gura Ialomiţei,,4631,1027066,543403,16548,0,6,0
47611060,LEGUMICOLA VIȘINA NOUĂ COOPERATIVĂ AGRICOLĂ,Olt,Stăvaru,Telefon: 0763528911; ,4619,1024829,0,41366,0,5,0
45368810,COOPERATIVA AGRICOLĂ OMI TIMIȘ,Timiş,Iohanisfeld,,4633,1020583,0,0,6685,5,0
41565045,AGRI JON VIŞINA COOPERATIVĂ AGRICOLĂ,Dâmboviţa,Vişina,,0111,1017850,1066572,0,190129,5,3
39151513,AGROHOR PROFESIONAL IZBICENI COOPERATIVA AGRICOLĂ,Olt,Izbiceni,,0111,1017328,560405,88693,0,5,1
45296144,AGRIAS-IANCA COOPERATIVĂ AGRICOLĂ,Brăila,Ianca,,4621,1015063,1295122,14524,0,5,0
39252763,AGRICOOP LA OLTEANCA COOPERATIVĂ AGRICOLĂ,Teleorman,Crângeni,,0111,1011752,109434,67799,0,6,0
44757398,NEW GREEN AGROFARM BUSSINES COOPERATIVĂ AGRICOLĂ,Galaţi,Furcenii Noi,,0113,1010042,558076,765747,0,6,1
44680049,MICII FERMIERI ZONA MONTANĂ COOPERATIVĂ AGRICOLĂ,Braşov,Budila,,4631,1006618,509404,0,128210,5,1
40787698,HAMBARE PLINE COOPERATIVA AGRICOLĂ,Dolj,Bechet,,,1002759,0,50969,0,22,0
39469119,AGRICOOP LA RUSCĂ COOPERATIVĂ AGRICOLĂ,Teleorman,Plosca,,0111,999290,0,0,30931,6,0
46974164,ALPHABIOLAND COOPERATIVĂ AGRICOLĂ,Galaţi,Lieşti,,0111,995543,15281,10120,0,6,0
44813315,M.M.BIO COOPERATIVĂ AGRICOLĂ,Covasna,Micfalău,,0141,988855,293372,0,55420,8,0
46852833,AGROSIKARIO COOPERATIVA AGRICOLĂ,Bihor,Curtuişeni,,4621,986694,0,442,0,8,1
39294475,LAUR ROŞIORU COOPERATIVĂ AGRICOLĂ,Olt,Vîrtopu,,0111,968033,895023,2695,0,5,0
39556363,AURUL CÂMPIEI COOPERATIVA AGRICOLĂ,Dolj,Unirea,Telefon: 0749195973; ,4611,965956,1097521,23848,0,5,1
41566385,RED HAPPY FRUIT COOPERATIVA AGRICOLĂ,Arad,Lipova,Telefon mobil: 0720054697; ,4631,962865,10259,6967,0,5,13
45071540,AGRISIC COOPERATIVĂ AGRICOLĂ,Covasna,Sânzieni,,4631,959764,239329,12192,0,5,0
44639465,INTER AGROCOOP COOPERATIVĂ AGRICOLĂ,Dolj,Sadova,,0149,958429,238012,203280,0,5,0
41481181,STENA BIOFARM COOPERATIVA AGRICOLĂ,Constanţa,Poarta Albă,Telefon: 0724982826; ,4621,950915,3738565,9861,0,10,0
35017773,SIC LAND COOP COOPERATIVA AGRICOLĂ,Covasna,Ilieni,Telefon mobil: 0753041053; ,0111,950124,524941,0,2200,7,0
41473820,DEALURI APUSENE COOPERATIVĂ AGRICOLĂ,Cluj,Dealu Negru,,4633,949705,744326,37836,0,8,0
34126462,STRAJA CALIMANILOR BILBOR COOPERATIVA AGRICOLĂ,Harghita,Bilbor,Telefon mobil: 0754659653; ,0150,949341,838593,0,102956,5,3
44870884,SPICUL AURIU BANATEAN COOPERATIVĂ AGRICOLĂ,Timiş,Variaş,Adresa de e-mail: av.simona.boanca@gmail.com; ,0111,935380,0,4508,0,5,0
43774986,BIOTARTLAU COOPERATIVĂ AGRICOLĂ,Braşov,Prejmer,,0111,931283,772037,154165,0,5,0
40543138,AGROGRUP 2019 COOPERATIVA AGRICOLĂ,Braşov,Sasciori,Telefon: 0765530816; ,0111,921836,855684,1165,0,5,0
37678933,DACIA NOASTRĂ COOPERATIVA AGRICOLĂ,Botoşani,Botoşani,Telefon mobil: 0740196933; ,0113,911865,1178871,0,1357711,8,1
46214029,AGROGREEN COOPERATIVĂ AGRICOLĂ,Iaşi,Leţcani,,,911124,0,0,1596,10,0
37990888,AGROMOVIS COOPERATIVA AGRICOLĂ,Gorj,Radosi,Telefon: 0765195198; ,0162,902155,665569,1053762,0,5,11
44929019,MAGTAR-COOP COOPERATIVĂ AGRICOLĂ,Covasna,Sfântu Gheorghe,,4631,901210,229699,9849,0,5,1
39817361,FERMIER AGROFAN STĂVARU COOPERATIVĂ AGRICOLĂ,Olt,Vişina Nouă,,1041,896072,1497752,94393,0,6,1
45285455,AGROWEL EXPRESS COOPERATIVĂ AGRICOLĂ,Sibiu,Ocna Sibiului,,4621,886913,831629,2015,0,5,0
44666788,LAZURANA FERM LACT COOPERATIVĂ AGRICOLĂ,Arad,Lazuri,Telefon mobil: 0759547556; ,4633,876190,549916,71092,0,7,0
45226688,GALTOS ZOOTEHNIC COOPERATIVĂ AGRICOLĂ,Mureş,Sânger,,4623,873021,49220,10716,0,6,0
26002641,CODREANA TRANSILVANIA COOPERATIVA AGRICOLĂ,Satu Mare,Satu Mare,Telefon: 0744384139; ,,872671,20000,969,0,5,1
45134142,OBÂRȘIA-CELEI-OLTUL COOPERATIVĂ AGRICOLĂ,Olt,Corabia,,4621,870355,420018,85669,0,21,1
45016724,SPICUL MOLDOMIXT COOPERATIVĂ AGRICOLĂ,Bistriţa-Năsăud,Ţăgsoru,Telefon: 0759547556; ,4621,854381,1054100,26653,0,10,0
39250681,TIANA GREEN LAND COOPERATIVĂ AGRICOLĂ,Olt,Corabia,,0111,844829,11125645,756564,0,8,2
39370661,COOP DEALUL CETĂŢII COOPERATIVĂ AGRICOLĂ,Teleorman,Cervenia,,0111,840929,1564192,6148,0,7,0
23634961,BURGOCOMCIUC SOCIETATE COOPERATIVĂ AGRICOLĂ,Harghita,Cozmeni,Telefon: 0266326631; Telefon mobil: 0744812053; Adresa de e-mail: primcoz@freemail.hu; Telefon mobil: 0722292985; ,4631,839876,736554,24458,0,67,1
37248243,COOPERATIVA AGRICOLA SI ZOOTEHNICA DUMITRA,Bistriţa-Năsăud,Dumitra,,0141,830530,564341,919,0,13,2
39695833,COOPERATIVA AGRICOLĂ CEREALE DUVACRIS,Tulcea,Tulcea,,0111,830238,2015035,0,574329,5,1
39465133,AGRODEZV CORNEANU COOPERATIVA AGRICOLĂ,Dolj,Băileşti,,0111,828173,336964,2156,0,7,1
37104124,LAZ-CĂPÎLNA COOPERATIVA AGRICOLĂ,Alba,Săsciori,,0162,828042,1118073,0,0,7,1
39054731,LEGUME OLTENEȘTI VĂDĂSTRIȚA COOPERATIVA AGRICOLĂ,Olt,Vădăstriţa,,4631,823569,1066252,154,0,6,0
44363431,ȘMAG DIN ȚARA BÂRSEI-GUSTURI LOCALE COOPERATIVĂ AGRICOLĂ,Braşov,Rotbav,,4611,822815,311814,0,70911,7,2
44912998,LENDÜLET COOPERATIVĂ AGRICOLĂ,Covasna,Bita,,4633,821880,555052,3036,0,12,1
44993372,DOBRO-AGROSPERA COOPERATIVĂ AGRICOLĂ,Tulcea,Satu Nou,Telefon mobil: 0756829357; ,0111,821319,822178,1265,0,5,0
44958502,FARMINTESAGRO COOPERATIVĂ AGRICOLĂ,Dolj,Preajba de Pădure,,0111,815941,0,6675,0,5,0
45177569,ȘEITINEANA COOPERATIVĂ AGRICOLĂ,Arad,Şeitin,Telefon: 0746319394; ,0141,813841,0,42172,0,6,0
44920079,DOPO AGRA COOPERATIVĂ AGRICOLĂ,Braşov,Făgăraş,Telefon mobil: 0737300900; ,4621,808488,203841,436,0,6,1
44347401,AGRICOOP TICA FARMES COOPERATIVĂ AGRICOLĂ,Teleorman,Peretu,,4631,792596,498583,335623,0,7,1
45362108,CAPRA CU CINCI IEZI COOPERATIVĂ AGRICOLĂ,Alba,Galda de Jos,,4633,780922,289655,0,116050,6,0
44845341,AVIROMAGRO COOPERATIVĂ AGRICOLĂ,Iaşi,Romaneşti,Telefon mobil: 0755904528; ,0147,775445,235613,1247,0,5,0
47938569,CAP PATRIA COOPERATIVĂ AGRICOLĂ,Olt,Piatra,Telefon: 0733076288; ,1091,775261,0,2618,0,5,0
44776179,COOPERATIVA AGRICOLĂ AGROCOP DALNIC,Covasna,Dalnic,,4631,769813,0,1377,0,7,0
48431105,ASM CEREALE COOPERATIVĂ AGRICOLĂ,Tulcea,Mihail Kogălniceanu,Telefon mobil: 0740153985; ,4621,766090,0,7012,0,8,0
39734614,COOPERATIVA AGRICOLĂ BUCOVĂȚ AGRICULTURĂ,Timiş,Bucovaţ,Telefon mobil: 074420190; ,0111,763679,1312342,0,35166,6,0
45355240,COOPERATIVA AGRICOLĂ TRANSYLVANIAN PURE FARMING COOPERATIVĂ AGRICOLĂ,Bistriţa-Năsăud,Teaca,,0113,760531,417961,158087,0,5,3
42177041,BOVITERRA NEW AGE COOPERATIVĂ AGRICOLĂ,Satu Mare,Lazuri,,0150,757263,819991,28067,0,16,0
41774840,TEOCOM FRUCT COOPERATIVĂ AGRICOLĂ,Dolj,Moţăţei,,,756211,0,13910,0,12,1
21317223,PROD ACTIV IMPEX SLOBOZIA MOARĂ COOPERATIVĂ AGRICOLĂ,Dâmboviţa,Slobozia Moara,Telefon: 0722362816; Telefon: 0722 362816; ,0113,755959,411326,144510,0,6,1
45278032,AGRI-SANCOM TURDA COOPERATIVĂ AGRICOLĂ,Tulcea,Turda,,0111,752588,702215,2225,0,5,0
44993828,AGRIPROD SATU MARE COOPERATIVĂ AGRICOLĂ,Satu Mare,Craidorolţ,,0111,735202,592101,0,36804,6,0
43249278,HOTARUL PECICA COOPERATIVĂ AGRICOLĂ,Arad,Oraş Pecica,Telefon mobil: 0759547556; ,4621,733993,348692,0,5087,5,0
39673355,SIMICI AGRI COOPERATIVĂ AGRICOLĂ,Brăila,Tichileşti,,0111,733899,735156,7880,0,6,0
44529926,TREI IZVOARE- BEIDAUD COOPERATIVĂ AGRICOLĂ,Tulcea,Beidaud,Telefon mobil: 0723560240; ,0111,728302,25185,31144,0,5,0
43545192,VALEA CRISULUI ALB BOCSIG COOPERATIVĂ AGRICOLĂ,Arad,Bocsig,Telefon: 0759547556; ,4621,723500,795324,26633,0,5,0
40037513,COOPERATIVA AGRICOLĂ TREI SPICE,Mehedinţi,Manu,,1061,723121,745926,31379,0,5,2
39956483,FERMA DALNIC COOPERATIVA AGRICOLĂ,Covasna,Dalnic,,4631,721557,587881,121137,0,5,1
35764671,COOPERATIVA AGRICOLA VOINTA,Hunedoara,Bacea,Telefon mobil: 0766590859; ,0111,713149,450973,69499,0,6,0
45213785,DIANU AGROSERVICE POIANA MARE COOPERATIVĂ AGRICOLĂ,Dolj,Calafat,,4621,711943,765292,2287,0,5,0
45189148,LEGUME DE POGOANELE COOPERATIVĂ AGRICOLĂ,Buzău,Pogoanele,,4631,706097,204173,6774,0,5,0
39451880,HOLDE BOGATE OLTENA COOPERATIVA AGRICOLĂ,Dolj,Gângiova,,0111,700858,1694372,0,129221,8,2
45016236,CONSENS-AGRO COOPERATIVĂ AGRICOLĂ,Timiş,Cărpiniş,Telefon mobil: 0744601177; ,4621,700253,1010748,11047,0,6,0
45369769,VALEA CUȘMEI COOPERATIVĂ AGRICOLĂ,Bistriţa-Năsăud,Lechinţa,,0141,696431,300767,998,0,5,0
44810874,COOPERATIVA AGRICOLĂ AGRO-BIO RUSTIOR,Bistriţa-Năsăud,Rustior,,,695348,179948,23293,0,43,0
44678804,PODGORII BOHOTIN COOPERATIVĂ AGRICOLĂ,Iaşi,Răducăneni,,,686253,0,0,188,8,0
45179438,TRADECOP AGRO COOPERATIVĂ AGRICOLĂ,Dolj,Gogoşu,,,683570,0,1698,0,5,0
38872015,ECOINTEGRITY COOPERATIVA AGRICOLĂ,Timiş,Fibiş,Telefon mobil: 0741189306; ,0111,680330,1011138,7718,0,5,1
43854732,BOVINE PÂLCURI COOPERATIVĂ AGRICOLĂ,Mureş,Dumbrava,,4623,678237,613132,8402,0,9,0
43355821,BAZINUL DORNELOR COOPERATIVĂ AGRICOLĂ,Suceava,Panaci,Telefon: 0742404881; ,4633,667759,621585,12140,0,5,1
39583805,AGRO TEASC COOPERATIVĂ AGRICOLĂ,Dolj,Perişor,,0111,659755,587652,16925,0,5,0
42210580,BUCATELE DACILOR COOPERATIVĂ AGRICOLĂ,Hunedoara,Orăstioara de Jos,Telefon mobil: 0788543173; ,4621,657334,22146,0,207143,8,3
45265504,BANDIPLANT COOPERATIVĂ AGRICOLĂ,Covasna,Sânzieni,,4631,656096,696647,0,73498,5,0
47426526,PESC DEM COOPERATIVĂ AGRICOLĂ,Constanţa,Sinoie,Telefon: 0734293858; Adresa de e-mail: dragoieugen@yahoo.com; ,0111,654753,0,3953,0,8,0
44169746,AGRICOLA AGROSPOR OLTENIA COOPERATIVĂ AGRICOLĂ,Dolj,Mlecaneşti,,4621,652390,709838,8891,0,12,0
30254876,APIVEST COOPERATIVĂ AGRICOLĂ,Timiş,Timişoara,,0149,650340,1053981,0,517222,5,2
44761364,CARTOFUL DE LA MUNTE BUDILA COOPERATIVĂ AGRICOLĂ,Braşov,Budila,Telefon mobil: 0740454489; ,4631,646907,286262,25160,0,5,1
45117400,PRIETENII CARTOFULUI ŞI LEGUMELOR COOPERATIVĂ AGRICOLĂ,Covasna,Catalina,,4631,644633,356386,1632,0,8,1
34258005,COOPERATIVA AGRICOLĂ AGROCOOP ŞIMAND,Arad,Şimand,Telefon mobil: 0742134965; ,,644562,34060,34339,0,5,0
44834482,VIISOARA FARM COOPERATIVĂ AGRICOLĂ,Constanţa,Viişoara,Telefon mobil: 0722221015; ,4621,639134,0,3360,0,6,0
41509240,GRUPUL DE PRODUCĂTORI RODUL POMILOR COOPERATIVĂ AGRICOLĂ,Suceava,Fălticeni,Telefon: 0742017669; ,4631,638308,0,16564,0,5,0
47548612,AGRO CONECT SOLUTION COOPERATIVĂ AGRICOLĂ,Constanţa,Constanţa,,4621,637364,0,17873,0,66,0
44181090,AGROCROP SUD-EST COOPERATIVĂ AGRICOLĂ,Tulcea,Tulcea,,0111,632755,1095104,0,32402,11,1
47283736,AGRO SUBCETATE COOPERATIVĂ AGRICOLĂ,Harghita,Subcetate,Telefon mobil: 0751833229; ,4633,621240,0,15462,0,5,0
44427802,AGRICOM ARMENOPOLIS COOPERATIVĂ AGRICOLĂ,Cluj,Salatiu,Telefon: 0759547556; ,4621,620429,418157,2139,0,5,1
45214977,PREMIUM BEEF OAȘ COOPERATIVĂ AGRICOLĂ,Satu Mare,Prilog,Telefon mobil: 0745961346; ,0142,612859,0,799,0,5,0
45109653,TRANSILVANIA AGRO LAND COOPERATIVĂ AGRICOLĂ,Alba,Şard,,4621,611834,26310,6784,0,12,0
46957830,ECOSILGEO COOPERATIVĂ AGRICOLĂ,Ialomiţa,Făcăeni,Telefon mobil: 0723497340; ,4621,607841,89030,26753,0,17,0
48635954,GREEN WATER FARM COOPERATIVĂ AGRICOLĂ,Dolj,Dobroteşti,Telefon: 0722252632; ,0111,606179,0,6572,0,7,1
44410320,PROD ALIMENT FRESH COOPERATIVĂ AGRICOLĂ,Dâmboviţa,Slobozia Moara,,0113,597828,278633,285214,0,5,0
45283578,GRAUNTE FERMECATE COOPERATIVĂ AGRICOLĂ,Giurgiu,Falaştoaca,,0111,593969,1251921,2747,0,5,0
39579073,OGOR PODZOL COOPERATIVA AGRICOLĂ,Dolj,Perişor,,0111,587227,1308001,1890,0,8,2
43859870,COOPERATIVA AGRICOLĂ TRADIȚIONAL CARPATIC COVASNA,Covasna,Covasna,Adresa de e-mail: traditionalcarpatic.cv@gmail.com; ,1011,575939,146018,0,93953,5,1
38557395,LEGUME PROASPETE SI SANATOASE COOPERATIVA AGRICOLĂ,Galaţi,Matca,Telefon mobil: 0766310841; ,7022,570967,32000,565372,0,20,0
48359131,TINERI FERMIERI DIN COGEALAC COOPERATIVĂ AGRICOLĂ,Constanţa,Cogealac,Telefon mobil: 0754869092; ,4621,569871,0,14281,0,6,0
43990793,AGRI MOARA DE JOS COOPERATIVĂ AGRICOLĂ,Mureş,Moara de Jos,,4633,569747,618213,6965,0,5,0
46469766,COOPERATIVA AGRICOLĂ MAXAGRO GĂTAIA,Timiş,Oraş Gătaia,,4621,567900,3432371,0,431209,7,1
43374637,CONTINENTAL FRUITS COOPERATIVĂ AGRICOLĂ,Hunedoara,Deva,,4631,550465,168851,22553,0,7,0
44768710,CONSULGRUP IZVOARELE COOPERATIVĂ AGRICOLĂ,Tulcea,Izvoarele,Telefon mobil: 0754501740; ,0113,547876,544924,29509,0,10,0
17898349,ŢARINA-COOPERATIVĂ AGRICOLĂ,Suceava,Iaslovăţ,Telefon: 0745491093; ,4721,540277,646813,9070,0,8,1
39487867,ICE AGRO CEZIENI COOPERATIVĂ AGRICOLĂ,Olt,Cezieni,,4611,539534,920229,0,132502,6,3
43971511,COOPERATIVA AGRICOLĂ ECOBIM,Dolj,Giurgiţa,Telefon: 0768084961; ,0150,538647,369036,13659,0,5,1
44733798,COOPERATIVA AGRICOLĂ RUSTIOREANCA HARNICA COOPERATIVĂ AGRICOLĂ,Bistriţa-Năsăud,Rustior,,0141,537082,0,0,40573,118,1
40987688,GRĂDINA BĂNĂȚEANĂ COOPERATIVA AGRICOLĂ,Timiş,Deta,,4631,528376,545477,0,29033,13,1
44254167,BEREI TARLÓ SZÖVETKEZET COOPERATIVĂ AGRICOLĂ,Satu Mare,Berea,Telefon mobil: 0744400137; ,4621,523650,317813,9325,0,5,0
44841315,APIS MS MURES COOPERATIVĂ AGRICOLĂ,Mureş,Tîrgu Mureş,,,518382,0,5503,0,29,0
42078706,APICULTORII VAII ARGESULUI COOPERATIVĂ AGRICOLĂ,Argeş,Recea,Telefon: 0729894036; Adresa de e-mail: alecsevalentin@yahoo.com; ,0149,513750,398764,1115,0,5,0
47393720,EFI AGRO COOPERATIVĂ AGRICOLĂ,Tulcea,Caugagia,Telefon mobil: 0732942330; ,4621,513057,0,203258,0,8,0
45116634,AGRA COSMAR COOPERATIVĂ AGRICOLĂ,Olt,Cezieni,,4621,509789,757368,1670,0,6,0
45086274,BIO SNOP COOPERATIVĂ AGRICOLĂ,Argeş,Piteşti,,0111,503278,478845,2228,0,5,0
45277240,FERMIERUL TELEORMĂNEAN COOPERATIVĂ AGRICOLĂ,Teleorman,Udupu,,4621,500878,84021,5652,0,14,0
39609751,BIAGRISTIN COOPERATIVA AGRICOLĂ,Vaslui,Simila,Telefon mobil: 0758382662; ,4621,500550,351688,62603,0,5,0
44606247,NUSSBACH COOPERATIVĂ AGRICOLĂ,Braşov,Măierus,,0141,500547,28108,0,102595,5,2
39457130,AGRO APROZI COOPERATIVA AGRICOLĂ,Călăraşi,Aprozi,,0111,499755,3334065,0,16037,6,1
44868493,CRÂNGURILE COOPERATIVĂ AGRICOLĂ,Prahova,Cireşanu,Telefon: 0745257464; Adresa de e-mail: dragosal@yahoo.com; ,4621,498894,787725,0,5963,8,1
45261634,BANEASA - CONSTANTA COOPERATIVĂ AGRICOLĂ,Constanţa,Băneasa,,0111,495891,0,0,9208,36,1
44871251,AGROMIRIAM SANISLAU COOPERATIVĂ AGRICOLĂ,Satu Mare,Sanislău,Telefon mobil: 0745331879; ,4621,491830,0,2141,0,5,0
44604076,MARAMUREŞANA NORD COOPERATIVĂ AGRICOLĂ,Maramureş,Sieu,,6201,472949,299015,0,14108,30,0
40525948,ŢARA LOVIŞTEI COOPERATIVĂ AGRICOLĂ,Vâlcea,Titeşti,,0150,471489,0,3765,0,7,1
44824551,AGROTOP TĂRTĂŞEŞTI COOPERATIVĂ AGRICOLĂ,Dâmboviţa,Tărtăseşti,Telefon mobil: 0745019538; ,4621,469137,399043,2678,0,5,0
41236190,TIN - FERM AGRO COOPERATIVĂ AGRICOLĂ,Olt,Strejeştii de Sus,,4631,462771,29009,13577,0,9,0
48475098,BLUEBERICA COOPERATIVĂ AGRICOLĂ,Braşov,Vistea de Jos,Telefon: 0752233949; ,4631,457881,0,3875,0,5,0
42948057,COOPERATIVA AGRICOLĂ A CRESCĂTORILOR DE BĂLŢATĂ ROMÂNEASCĂ COOPERATIVĂ AGRICOLĂ,Braşov,Hărman,,1011,455352,15100,8597,0,8,0
44776136,VI-VA-BR PROD COOPERATIVĂ AGRICOLĂ,Covasna,Zăbala,,4623,452342,123849,2280,0,5,0
45260779,AGROFAN CERÃT COOPERATIVĂ AGRICOLĂ,Dolj,Cerat,,,451326,0,10352,0,6,0
45637616,FRESH FRUITS HERTEA COOPERATIVĂ AGRICOLĂ,Constanţa,Băneasa,,0113,446932,447538,0,38282,5,2
40705469,POMICULTORUL COOPERATIVA AGRICOLĂ,Vrancea,Răstoaca,Adresa de e-mail: biroufocsani@gmail.com; Telefon: 0722313535; ,4631,441537,142060,5629,0,9,0
44815570,AGROBOB ARDEAL COOPERATIVĂ AGRICOLĂ,Cluj,Jucu de Sus,Telefon: 0744872663; ,0141,434466,850672,357,0,16,0
46957155,GREEN INOVATIONS FARM COOPERATIVĂ AGRICOLĂ,Dolj,Craiova,,0130,432907,21000,198792,0,5,2
46532774,DIN CARPAȚI UN PĂSTRĂV PENTRU FIECARE COOPERATIVĂ AGRICOLĂ,Prahova,Buşteni,,0322,426896,73830,4734,0,8,0
42193098,AGROMAT POIANA COOPERATIVĂ AGRICOLĂ,Dolj,Poiana Mare,Telefon: 0766639542; ,0150,426340,0,28056,0,5,2
44543467,COOPERATIVA AGRICOLĂ UTILAND GRADISTEA,Brăila,Gradistea,,0111,426104,403930,19884,0,5,0
43637288,AGROLACT TOTH COOPERATIVĂ AGRICOLĂ,Mureş,Sărmăşel,Telefon: 0759547556; ,4633,424364,186804,6566,0,5,0
44973235,GRÂNARUL COOPERATIVĂ AGRICOLĂ,Constanţa,Pantelimon,Telefon mobil: 0726675993; ,4621,424008,2112105,27878,0,6,0
37248367,COOPERATIVA AGRICOLA ȘI ZOOTEHNICA CEPARI,Bistriţa-Năsăud,Cepari,,0141,422305,252750,0,0,10,1
