category,company,project_title,budget,county
constructii,Licitatie restransa atribuire contract lucrari de constructii in cadrul proiectului Construire imobil cu apartamente destinate cazarii de sc,"Anunturi [proceduri de achizitie, beneficiari privati]: Licitatie restransa atribuire contract lucrari de constructii in cadrul proiectului Construire imobil cu apartamente destinate cazarii de scurta durata, imprejmuire si racorduri la utilitati",1706854.0,Neamt
constructii,executia de lucrari si furnizarea de echipamente pentru proiectul cu titlul Imbunatatirea infrastructurii,"Anunturi [proceduri de achizitie, beneficiari privati]: Proiectarea, executia de lucrari si furnizarea de echipamente pentru proiectul cu titlul Imbunatatirea infrastructurii in banda larga si a accesului la internet in judetul Alba",14971255.37,Bucuresti
constructii,Lucrari de constructii si instalatii pentru realizare spatiu necesar pentru prestarea activitatii,"Anunturi [proceduri de achizitie, beneficiari privati]: Procedura de atribuire a contractului de lucrari de constructie: Lucrari de constructii si instalatii pentru realizare spatiu necesar pentru prestarea activitatii de realizarea soft la comanda",5159938.78,Covasna
constructii,CONSOLIDAREA POZITIEI PE PIATA SI DIVERSIFICAREA ACTIVITATII A ENTIRE CONSULTING &MANAGEMENT SRL,"Anunturi [proceduri de achizitie, beneficiari privati]: CONSOLIDAREA POZITIEI PE PIATA SI DIVERSIFICAREA ACTIVITATII A ENTIRE CONSULTING &MANAGEMENT SRL PRIN CONSTRUIREA SI DOTAREA UNEI PENSIUNI TURISTICE IN ORASUL SEINI ,JUDETUL MARAMURES",1242055.11,Maramures
constructii,furnizare bunuri si asigurarea utilitatilor necesare obiectivului si organizare de sa,"Anunturi [proceduri de achizitie, beneficiari privati]: Reluare procedura Contract de executie lucrari, furnizare bunuri si asigurarea utilitatilor necesare obiectivului si organizare de santier",1649662.42,Satu Mare
constructii,Modernizarea si extinderea capacitatii de productie a societatii Jung Wohnmobile SRL,"Anunturi [proceduri de achizitie, beneficiari privati]: Documentatie de atribuire (inclusiv specificatiile tehnice) LUCRARI DE CONSTRUCTII in cadrul proiectului: Modernizarea si extinderea capacitatii de productie a societatii Jung Wohnmobile SRL Germania, filiala Zalau",3433200.42,Salaj
constructii,Modernizarea si extinderea capacitatii de productie a societatii Jung Wohnmobile SRL,"Anunturi [proceduri de achizitie, beneficiari privati]: Documentatie de atribuire (inclusiv specificatiile tehnice) LUCRARI DE CONSTRUCTII in cadrul proiectului: Modernizarea si extinderea capacitatii de productie a societatii Jung Wohnmobile SRL Germania, filiala Zalau",3776131.63,Salaj
constructii,Proiectare si executie lucrari aferent proiectului Imbunatatirea infrastructurii,"Anunturi [proceduri de achizitie, beneficiari privati]: Proiectare si executie lucrari aferent proiectului Imbunatatirea infrastructurii in banda larga si a accesului la internet in judetul Vrancea",13897060.01,Bucuresti
constructii,Proiectare si executie lucrari aferent proiectului Imbunatatirea infrastructurii,"Anunturi [proceduri de achizitie, beneficiari privati]: Proiectare si executie lucrari aferent proiectului Imbunatatirea infrastructurii in banda larga si a accesului la internet in judetele Prahova si Dambovita",8188504.76,Bucuresti
constructii,RESTAURARE CONSOLIDARE SI PUNERE IN VALOARE A BISERICII SF. NICOLAE POPA SA,"Anunturi [proceduri de achizitie, beneficiari privati]: RESTAURARE CONSOLIDARE SI PUNERE IN VALOARE A BISERICII SF. NICOLAE POPA SAVU, CAMPULUNG MUSCEL, JUDETUL ARGES",3687903.26,Arges
constructii,extindere si dotare centru social de zi pentru persoane varstnice Sfintii,"Anunturi [proceduri de achizitie, beneficiari privati]: Reabilitare, modernizare,extindere si dotare centru social de zi pentru persoane varstnice  Sfintii Doctori fara de arginti Cosma si Damian",2892088.97,Dolj
constructii,conservare si introducere in circuitul turistic la Ansamblul Bisericii,"Anunturi [proceduri de achizitie, beneficiari privati]: Procedura competitiva - Atribuire contract executie lucrari - Proiect: Lucrari de reparatii, conservare si introducere in circuitul turistic la Ansamblul Bisericii Evanghelice Fortificate din Vulcan",1041614.91,Hunedoara
constructii,CONSERVARE SI INTRODUCERE IN CIRCUITUL TURISTIC LA ANSAMBLUL BISERICII,"Anunturi [proceduri de achizitie, beneficiari privati]: Procedura competitiva - Atribuire contract executie lucrari - Proiect: LUCRARI DE REPARATII, CONSERVARE SI INTRODUCERE IN CIRCUITUL TURISTIC LA ANSAMBLUL BISERICII EVANGHELICE FORTIFICATE RUJA",1001822.97,Sibiu
constructii,restaurare si introducere in circuitul turistic la Ansamblul Bisericii,"Anunturi [proceduri de achizitie, beneficiari privati]: Atribuire contract executie lucrari - Proiect Lucrari de reparare, conservare, restaurare si introducere in circuitul turistic la Ansamblul Bisericii Evanghelice Fortificate Codlea",2354886.58,Brasov
constructii,RESTAURARE SI INTRODUCERE IN CIRCUITUL TURISTIC LA ANSAMBLUL BISERICII,"Anunturi [proceduri de achizitie, beneficiari privati]: Procedura competitiva - Atribuire contract executie lucrari - Proiect: LUCRARI DE REPARARE, CONSERVARE, RESTAURARE SI INTRODUCERE IN CIRCUITUL TURISTIC LA ANSAMBLUL BISERICII EVANGHELICE FORTIFICATE CODLEA",2354886.58,Brasov
constructii,ASIGURAREA UTILITATILOR NECESARE OBIECTIVULUI SI ORGANIZARE DE SA,"Anunturi [proceduri de achizitie, beneficiari privati]: CONTRACT DE EXECUTIE LUCRARI, ASIGURAREA UTILITATILOR NECESARE OBIECTIVULUI SI ORGANIZARE DE SANTIER",1172008.6,Satu Mare
constructii,Executie lucrari de constructii pentru proiectul de investitii,"Anunturi [proceduri de achizitie, beneficiari privati]: Executie lucrari de constructii pentru proiectul de investitii ""Reparatii exterioare, consolidare biserica, restaurare si conservare picturi interioare ale bisericii ""Sfanta Treime"" - Gherman""",1845103.99,Ilfov
constructii,Atribuire contract de lucrari de constructii si instalatii,"Anunturi [proceduri de achizitie, beneficiari privati]: Atribuire contract de lucrari de constructii si instalatii service auto",677925.0,Bucuresti
constructii,Diversificarea activitatii societatii SENSE&COFFEE SRL,"Anunturi [proceduri de achizitie, beneficiari privati]: Diversificarea activitatii societatii SENSE&COFFEE SRL",660626.0,Vrancea
constructii,ACHIZITIE DE LUCRARI DE CONSTRUCTII SI INSTALATII,"Anunturi [proceduri de achizitie, beneficiari privati]: ACHIZITIE DE LUCRARI DE CONSTRUCTII SI INSTALATII AFERENTE",3075657.68,Giurgiu
constructii,CENTRUL PENTRU SERVICII DE RADIOCOMUNICATII SRL,-,15274880.58,Bucuresti
constructii,VALORIFICAREA TURISTICA A ANSAMBLULUI BISERICII,"Anunturi [proceduri de achizitie, beneficiari privati]: Achizitie lucrari de constructii pentru proiectul ""VALORIFICAREA TURISTICA A ANSAMBLULUI BISERICII SF. GHEORGHE A BRESLEI ABAGERILOR, DIN MUNICIPIUL BARLAD"", COD SMIS 117354",6236426.0,Vaslui
constructii,dar si a lucrarilor aferente organizarii de sa,"Anunturi [proceduri de achizitie, beneficiari privati]: Contract de realizare lucrari de demolare, extindere, reabilitare, dotare cu echipamente si utilaje cu montaj a obiectivului de finantare, dar si a lucrarilor aferente organizarii de santier",2682788.94,Bihor
constructii,ACHIZITIE EXECUTIE LUCRARI DE CONSTRUCTII,"Anunturi [proceduri de achizitie, beneficiari privati]: ACHIZITIE EXECUTIE LUCRARI DE CONSTRUCTII",4013591.0,Iasi
constructii,EMI EQUIPEMENT MAINTENANCE INDUSTRIE S.A.,"Anunturi [proceduri de achizitie, beneficiari privati]: Achizitie contract de executie lucrari si furnizare echipamente",478000.0,Arges
constructii,WELKINS FIRE PROTECTION SOLUTIONS S.R.L.,"Anunturi [proceduri de achizitie, beneficiari privati]: Infiintare fabrica sisteme de ventilatie la Racari, cod SMIS 102527",780588.28,Dambovita
constructii,componenta a ansamblului protejat UNESC,"Anunturi [proceduri de achizitie, beneficiari privati]: Executia lucrarilor in cadrul proiectului Conservarea, reabilitarea si promovarea Bisericii Evanghelice din Calnic (jud. Alba) componenta a ansamblului protejat UNESCO",2898764.48,Alba
constructii,INTREPRINDEREA DE MOBILA FLORENTA SRL,-,2277443.79,Cluj
constructii,Lucrari de constructie si instalatii,"Anunturi [proceduri de achizitie, beneficiari privati]: Lucrari de constructie si instalatii a atelierului de croitorie + dotari (panouri solare, panouri fotovoltaice, sistem de iluminat eficient din punct de vedere energetic si sistem de incalzire: cazan pe peleti)",462817.92,Cluj
constructii,lucrari de constructii si instalatii,"Anunturi [proceduri de achizitie, beneficiari privati]: lucrari de constructii si instalatii, de restaurare a Bisericii Sfintii Voievozi Tandarei (monument istoric cod LMI: IL -II -m -B 14164)",655429.76,Ialomita
constructii,BDUL STEFAN CEL MARE SI SFANT 16 -,"Anunturi [proceduri de achizitie, beneficiari privati]: Achizitie de lucrari",1542595.75,Iasi
constructii,EASYDO DIGITAL TECHNOLOGIES S.R.L.,"Anunturi [proceduri de achizitie, beneficiari privati]: Achizitia lucrarilor de constructie, inclusiv instalatiile si a echipamentelor tehnologice cu montaj (exclusiv postul trafo), organizarea de santier",16000697.67,Bucuresti
constructii,Executia de lucrari de constructii,"Anunturi [proceduri de achizitie, beneficiari privati]: Executia de lucrari de constructii in cadrul proiectului Construire hala industriala",802857.0,Bihor
constructii,Reabilitarea Ansamblului Bisericii,"Anunturi [proceduri de achizitie, beneficiari privati]: Procedura competitiva - Atribuire contract executie lucrari - Proiect: Reabilitarea Ansamblului Bisericii Evanghelice Fortificate Agnita",4570784.89,Sibiu
constructii,CENTRUL DE AFACERI GREEN PARK SRL,"Anunturi [proceduri de achizitie, beneficiari privati]: Procedura competitiva de achizitie lucrari de tamplarie aluminiu",9021.15,Vrancea
constructii,CENTRUL DE AFACERI GREEN PARK SRL,"Anunturi [proceduri de achizitie, beneficiari privati]: Achizitia de lucrari din piatra naturala - arhitectura rest de executat",44793.74,Vrancea
constructii,CENTRUL DE AFACERI GREEN PARK SRL,"Anunturi [proceduri de achizitie, beneficiari privati]: Achizitii lucrari instalatii electrice",106567.1,Vrancea
constructii,CENTRUL DE AFACERI GREEN PARK SRL,"Anunturi [proceduri de achizitie, beneficiari privati]: Procedura competitiva achizitie lucrari de constructie",2524500.0,Vrancea
constructii,CORAMED MEDIZINISCHE PRODUKTE SRL,"Anunturi [proceduri de achizitie, beneficiari privati]: Lucrari de constructii",4079455.0,Bucuresti
constructii,CORAMED MEDIZINISCHE PRODUKTE SRL,"Anunturi [proceduri de achizitie, beneficiari privati]: Lucrari de constructii",4079455.07,Bucuresti
constructii,RITECH INTERNATIONAL IMPEX S.R.L.,"Anunturi [proceduri de achizitie, beneficiari privati]: Achizitie de lucrari de constructie Grupa 2: Instalatii",2830019.59,Bucuresti
constructii,RITECH INTERNATIONAL IMPEX S.R.L.,"Anunturi [proceduri de achizitie, beneficiari privati]: Achizitie de lucrari de constructie Grupa 1: Amenajari pentru protectia mediului, Constructii si instalatii si organizare de santier",3726189.0,Bucuresti
constructii,ACHIZITIE LUCRARI DE CONSTRUCTII,"Anunturi [proceduri de achizitie, beneficiari privati]: ACHIZITIE LUCRARI DE CONSTRUCTII SI DOTARI",3610559.57,Neamt
constructii,B-DUL AUREL VLAICU 135 CAMERA 15,"Anunturi [proceduri de achizitie, beneficiari privati]: Lucrari de constructie + utilaje,echipamente tehnologice",1003652.23,Constanta
constructii,B-DUL AUREL VLAICU 135 CAMERA 15,"Anunturi [proceduri de achizitie, beneficiari privati]: Lucrari de constructie + utilaje,echipamente tehnologice",1078616.24,Constanta
constructii,CENTRUL MEDICAL TRANSILVANIA SRL,"Anunturi [proceduri de achizitie, beneficiari privati]: Achizitie lucrari de executie pentru centrul de cercetare, in cadrul proiectului: Centru de cercetare si dezvoltare privind diagnosticul si tratamentul accidentelor vasculare cerebrale; SMIS: 121574",14556639.15,Cluj
constructii,CENTRUL MEDICAL TRANSILVANIA SRL,"Anunturi [proceduri de achizitie, beneficiari privati]: Achizitie lucrari de executie pentru centrul de cercetare, in cadrul proiectului: Centru de cercetare si dezvoltare privind diagnosticul si tratamentul accidentelor vasculare cerebrale; SMIS: 121574",9774948.97,Cluj
constructii,INDUSTRIAL PLASTIC RECYCLING SRL,-,2788024.7,Ilfov
constructii,INVESTIGATII MEDICALE PRAXIS SRL,"Anunturi [proceduri de achizitie, beneficiari privati]: Achizitie lucrari de constructie laborator de analize medicale si echipamente cu montaj aferente lucrarilor de constructie",3908679.09,Iasi
constructii,REI INTERNATIONAL CONSULTING SRL,-,6741769.47,Bucuresti
constructii,ECO TROUT FARMING LEAOTA S.R.L.,"Anunturi [proceduri de achizitie, beneficiari privati]: Executie lucrari realizare investitie si a echipamentelor cu montaj pentru proiectul Infiintare unitate de acvacultura si dezvoltarea de activitati complementare acesteia  construire ferma pentru cresterea pastravului, captare de apa, priza tiroleza, desnisipator, statie de pompare, casa pastravarului D+P+M, cod SMIS 155916",3364449.24,Dambovita
constructii,ELECTRO-SERVICE DISTRIBUTIE SRL,"Anunturi [proceduri de achizitie, beneficiari privati]: EXECUTIE LUCRARI, INCLUSIV ECHIPAMENTE CU MONTAJ  REST DE EXECUTAT",2103063.09,Bucuresti
constructii,ELECTRO-SERVICE DISTRIBUTIE SRL,"Anunturi [proceduri de achizitie, beneficiari privati]: EXECUTIE LUCRARI, INCLUSIV ECHIPAMENTE CU MONTAJ",1780055.47,Bucuresti
constructii,ELECTRO-SERVICE DISTRIBUTIE SRL,"Anunturi [proceduri de achizitie, beneficiari privati]: EXECUTIE LUCRARI, INCLUSIV ECHIPAMENTE CU MONTAJ",2046915.68,Bucuresti
constructii,GROUP CONSTRUCT BUCOVINA S.R.L.,"Anunturi [proceduri de achizitie, beneficiari privati]: Lucrari de constructii",1504153.48,Suceava
constructii,GROUP CONSTRUCT BUCOVINA S.R.L.,"Anunturi [proceduri de achizitie, beneficiari privati]: Lucrari de Constructii",1504153.48,Suceava
constructii,GROUP CONSTRUCT BUCOVINA S.R.L.,"Anunturi [proceduri de achizitie, beneficiari privati]: Lucrari de Contructii",1504153.48,Suceava
constructii,MEDICAL BUSINESS MANAGEMENT SRL,constructii,5239985.06,Arad
constructii,ORGANIZARE DE SANTIER SI SPATII,"Anunturi [proceduri de achizitie, beneficiari privati]: ACHIZITIE DE LUCRARI INCLUSIV ECHIPAMENTE TEHNOLOGICE CU MONTAJ PENTRU REALIZAREA PROIECTULUI  PENSIUNE TURISTICA, IMPREJMUIRE, ORGANIZARE DE SANTIER SI SPATII VERZI",1226248.59,Constanta
constructii,ORGANIZARE DE SANTIER SI SPATII,"Anunturi [proceduri de achizitie, beneficiari privati]: ACHIZITIE DE LUCRARI INCLUSIV ECHIPAMENTE TEHNOLOGICE CU MONTAJ PENTRU REALIZAREA PROIECTULUI PENSIUNE TURISTICA, IMPREJMUIRE, ORGANIZARE DE SANTIER SI SPATII VERZI",944884.99,Constanta
constructii,ORGANIZARE DE SANTIER SI SPATII,"Anunturi [proceduri de achizitie, beneficiari privati]: ACHIZITIE DE LUCRARI INCLUSIV ECHIPAMENTE TEHNOLOGICE CU MONTAJ PENTRU REALIZAREA PROIECTULUI PENSIUNE TURISTICA, IMPREJMUIRE, ORGANIZARE DE SANTIER SI SPATII VERZI",1226248.59,Constanta
constructii,RESIDENCE LAKE TATLAGEAC S.R.L.,"Anunturi [proceduri de achizitie, beneficiari privati]: Lucrari de constructii in cadrul proiectului ""CONSTRUIRE PENSIUNE TURISTICA",1580648.9,Constanta
constructii,RESTAURARE ANSAMBLUL BISERICII,"Anunturi [proceduri de achizitie, beneficiari privati]: Lucrari de reabilitare - CONSOLIDARE, RESTAURARE ANSAMBLUL BISERICII UNITARIENE FORTIFICATE",4862653.38,Covasna
constructii,SMART INTEGRATED SOLUTIONS SRL,constructie a cladirii,6073788.06,Bucuresti
constructii,ANDMAN PREST CONSTRUCT S.R.L.,"Anunturi [proceduri de achizitie, beneficiari privati]: ACHIZITIE IN VEDEREA ATRIBUIRII CONTRACTULUI DE LUCRARI PROIECTARE SI EXECUTIE LUCRARI DE CONSTRUCTIE",924827.1,Hunedoara
constructii,CARGO TRANS INTERNATIONAL SRL,"Anunturi [proceduri de achizitie, beneficiari privati]: Rest de executat - lucrari de constructii si instalatii in cadrul proiectului CONSTRUIRE IMOBIL CU DESTINATIA HOTEL S+P+4 CU SPATII PENTRU ASIGURAREA HRANEI SI BAUTURILOR SI SPATII PENTRU CONFERINTE, CONVENTII SI ACTIVITATI RECREATIVE, PARCAJ IN INCINTA SI IMPREJMUIRE TEREN CU L=99 M",3320621.28,Dolj
constructii,CARGO TRANS INTERNATIONAL SRL,"Anunturi [proceduri de achizitie, beneficiari privati]: CONSTRUIRE IMOBIL CU DESTINATIA HOTEL S+P+4 CU SPATII PENTRU ASIGURAREA HRANEI SI BAUTURILOR SI SPATII PENTRU CONFERINTE, CONVENTII SI ACTIVITATI RECREATIVE, PARCAJ IN INCINTA SI IMPREJMUIRE TEREN CU L=99 M",5027017.0,Dolj
constructii,INTEGRAL CHINCIU COMIMPEX SRL,-,7389887.74,Hunedoara
constructii,MARCOSTAR CONSTRUCT STIL S.A.,"Anunturi [proceduri de achizitie, beneficiari privati]: Achizitie de lucrari de constructii si instalatii",21321083.97,Constanta
constructii,MARCOSTAR CONSTRUCT STIL S.A.,"Anunturi [proceduri de achizitie, beneficiari privati]: Lucrari suplimentare de constructii",1142220.0,Constanta
constructii,NETWORK INNOVATION FUTURE SRL,"Anunturi [proceduri de achizitie, beneficiari privati]: Proiectare si executie lucrari in cadrul proiectului Investitii in infrastructura broadband in judetele Giurgiu si Teleorman",9626187.07,Bucuresti
constructii,NETWORK INNOVATION FUTURE SRL,"Anunturi [proceduri de achizitie, beneficiari privati]: Proiectare si executie lucrari in cadrul proiectului Investitii in infrastructura broadband in judetul Galati",13897903.57,Bucuresti
constructii,NETWORK INNOVATION FUTURE SRL,"Anunturi [proceduri de achizitie, beneficiari privati]: Proiectare si executie lucrari in cadrul proiectului Investitii in infrastructura broadband in judetul Vaslui",25134869.26,Bucuresti
constructii,NETWORK INNOVATION FUTURE SRL,"Anunturi [proceduri de achizitie, beneficiari privati]: Proiectare si executie lucrari in cadrul proiectului Investitii in infrastructura broadband in judetul Bistrita Nasaud""",11141665.28,Bucuresti
constructii,NETWORK INNOVATION FUTURE SRL,"Anunturi [proceduri de achizitie, beneficiari privati]: Proiectare si executie lucrari in cadrul proiectului Investitii in infrastructura broadband in judetul Olt",8959851.55,Bucuresti
constructii,NETWORK INNOVATION FUTURE SRL,"Anunturi [proceduri de achizitie, beneficiari privati]: Proiectare si executie lucrari in cadrul proiectului Investitii in infrastructura broadband in judetele Timis si Caras-Severin""",9938079.75,Bucuresti
constructii,NETWORK INNOVATION FUTURE SRL,"Anunturi [proceduri de achizitie, beneficiari privati]: Proiectare si executie lucrari in cadrul proiectului Investitii in infrastructura broadband in judetul Mures",9351439.69,Bucuresti
constructii,ORIZONT SIGHETU MARMATIEI SRL,"Anunturi [proceduri de achizitie, beneficiari privati]: ACHIZITIE LUCRARI DE CONSTRUCTII PENTRU PROIECTUL HOTEL Dp+P+2E+Mp, IMPREJMUIRE SI SEMNALISTICA",10828180.33,Maramures
constructii,ALPHA QUALITY INNOVATION SRL,-,3790616.0,Giurgiu
echipamente,Sistem automatizare alimentare presa in vederea implementarii proiectului Cresterea competitivitatii economice a S.C. MUSA PITESTI 96 S.R.L.,"Anunturi [proceduri de achizitie, beneficiari privati]:  Furnizare echipamente/utilaje tehnologice - (Sistem automatizare alimentare presa in vederea implementarii proiectului Cresterea competitivitatii economice a S.C. MUSA PITESTI 96 S.R.L. pe piata interna si externa prin dezvoltarea capacitatilor productive .",1707469.92,Arges
echipamente,ATRIBUIREA CONTRACTULUI DE FURNIZARE SETURI COMPLETE MOBILIER PENTRU PROIECTUL CONSTRUIRE IMOBIL CU APARTAMENTE DESTINATE CAZARII DE SC,"Anunturi [proceduri de achizitie, beneficiari privati]: ATRIBUIREA CONTRACTULUI DE FURNIZARE SETURI COMPLETE MOBILIER PENTRU PROIECTUL CONSTRUIRE IMOBIL CU APARTAMENTE DESTINATE CAZARII DE SCURTA DURATA, IMPREJMUIRE SI RACORDURI LA UTILITATI",163750.0,Neamt
echipamente,Contract de furnizare bunuri si dotari in cadrul Asociatiei Judetene a Vanatorilor si Pescarilor Sportivi Sa,"Anunturi [proceduri de achizitie, beneficiari privati]: Contract de furnizare bunuri si dotari in cadrul Asociatiei Judetene a Vanatorilor si Pescarilor Sportivi Satu Mare - achizitie pe loturi",145358.75,Satu Mare
echipamente,Dezvoltarea activitatii de pregatire a terenului in cadrul companiei DM Management & Capital Invest SRL,"Anunturi [proceduri de achizitie, beneficiari privati]: Achizitionare utilaje tip miniincarcator in cadrul proiectului ""Dezvoltarea activitatii de pregatire a terenului in cadrul companiei DM Management & Capital Invest SRL la punctul de lucru din orasul Tulcea""",845436.0,Bucuresti
echipamente,in vederea implementarii proiectului Cresterea competitivitatii economice a S.C. MUSA PITESTI 96 S.R.L.,"Anunturi [proceduri de achizitie, beneficiari privati]: Furnizare echipamente/utilaje tehnologice - (proiector optic)  in vederea implementarii proiectului Cresterea competitivitatii economice a S.C. MUSA PITESTI 96 S.R.L. pe piata interna si externa prin dezvoltarea capacitatilor productive",181365.58,Arges
echipamente,in vederea implementarii proiectului Cresterea competitivitatii economice a S.C. MUSA PITESTI 96 S.R.L.,"Anunturi [proceduri de achizitie, beneficiari privati]: Furnizare echipamente/utilaje tehnologice - (presa)  in vederea implementarii proiectului Cresterea competitivitatii economice a S.C. MUSA PITESTI 96 S.R.L. pe piata interna si externa prin dezvoltarea capacitatilor productive .",2762751.2,Arges
echipamente,ACHIZITIA DE Masina de taiere si perforare cu laser cu software specific si alte accesorii,"Anunturi [proceduri de achizitie, beneficiari privati]: ACHIZITIA DE Masina de taiere si perforare cu laser cu software specific si alte accesorii",1600000.0,Brasov
echipamente,ACHIZITIA DE Masina de taiere si perforare cu laser cu software specific si alte accesorii,"Anunturi [proceduri de achizitie, beneficiari privati]: ACHIZITIA DE Masina de taiere si perforare cu laser cu software specific si alte accesorii",1540000.0,Brasov
echipamente,Procedura de atribuire a contractului de furnizare echipamente pentru procesa,"Anunturi [proceduri de achizitie, beneficiari privati]: Procedura de atribuire a contractului de furnizare echipamente pentru procesare primara peste",523856.0,Maramures
echipamente,Achizitia privata competitiva pentru - Achizitie de Servicii catering sc,"Anunturi [proceduri de achizitie, beneficiari privati]: Achizitia privata competitiva pentru - Achizitie de Servicii catering scoli- CPV 55524000-9",599460.0,Cluj
echipamente,Diversificarea si modernizarea activitatii SC N&A PROJECT CONSULTING SRL,"Anunturi [proceduri de achizitie, beneficiari privati]: Achizitie mijloace fixe in cadrul proiectului "" Diversificarea si modernizarea activitatii SC N&A PROJECT CONSULTING SRL prin achizitia unor utilaje moderne"" cod SMIS 108368",405637.61,Neamt
echipamente,premii acordate copiilor in vederea participarii la diverse competitii,"Anunturi [proceduri de achizitie, beneficiari privati]: Jucarii si articole sportive (premii acordate copiilor in vederea participarii la diverse competitii)  105515",22083.34,Bucuresti
echipamente,Procedura competitiva Pachete imbracaminte si incaltaminte presc,"Anunturi [proceduri de achizitie, beneficiari privati]: Procedura competitiva Pachete imbracaminte si incaltaminte prescolari si elevi",309497.88,Bucuresti
echipamente,Echipamente de teledetectie si echipamente de detectie a specii,"Anunturi [proceduri de achizitie, beneficiari privati]: Echipamente de teledetectie si echipamente de detectie a speciilor de lilieci cu ajutorul ultrasunetelor/ Telemetry equipment and ultrasound bat detection equipment",528.48,Bucuresti
echipamente,Servicii de organizare seminarii tematice in urmatoarelor arii,"Anunturi [proceduri de achizitie, beneficiari privati]: Servicii de organizare seminarii tematice in urmatoarelor arii: Etica in Afaceri, Dezvoltarea Durabila, Inovarea Sociala, Egalitatea de sanse si Nediscriminarea in urmatoarele judete: Olt, Dolj, Mehedinti, Valcea si Gorj (4 seminarii/judet = 20 de evenimente), CPV 799510005 - Servicii de organizare seminarii in cadrul proiectului Antreprenori, la START!, ID contract: POCU/82/3/7/105412",42016.81,Bucuresti
echipamente,FINANCIAL SERVICES GROUP BROKER DE ASIGURARE-REASIGURARE SRL,-,352200.0,Bacau
echipamente,Achizitia unui echipament performant la SC COME & CLEAN SRL,"Anunturi [proceduri de achizitie, beneficiari privati]: Achizitia unui echipament performant la SC COME & CLEAN SRL",979728.0,Bacau
echipamente,consumabile si alte produse similare necesare desfasurarii,"Anunturi [proceduri de achizitie, beneficiari privati]: Achizitie de substante, materiale, plante, animale de laborator, consumabile si alte produse similare necesare desfasurarii activitatilor de cercetare fundamentala/ industriala/ dezvoltare experimentala (multiple loturi) - materiale consumabile si plachete",2362.6,Bucuresti
echipamente,FURNIZARE ACTIVE CORPORALE- Cabina de vopsire si usc,"Anunturi [proceduri de achizitie, beneficiari privati]: FURNIZARE ACTIVE CORPORALE- Cabina de vopsire si uscare presurizata",605357.6,Bucuresti
echipamente,TPS ACME-ANTREPRIZA CONSTRUCTII-MONTAJ ENERGETIC SRL,"Anunturi [proceduri de achizitie, beneficiari privati]: Achizitie echipamente tehnologice",302330.0,Buzau
echipamente,ACHIZITIE CONSTRUCTII PLUTITOARE -ADAPOST PESCARESC,"Anunturi [proceduri de achizitie, beneficiari privati]: ACHIZITIE CONSTRUCTII PLUTITOARE -ADAPOST PESCARESC",4636240.0,Tulcea
echipamente,CENTRU DE DIAGNOSTIC SI TRATAMENT SEBES-ALBA S.R.L.,"Anunturi [proceduri de achizitie, beneficiari privati]: Documentatie de atribuire pentru achizitia echipamentelor electrocardiograf si sistem de testare la efort",34396.0,Alba
echipamente,CENTRU DE DIAGNOSTIC SI TRATAMENT SEBES-ALBA S.R.L.,"Anunturi [proceduri de achizitie, beneficiari privati]: Documentatie de atribuire pentru achizitia echipamentului concentrator oxigen",2490.0,Alba
echipamente,CENTRU DE DIAGNOSTIC SI TRATAMENT SEBES-ALBA S.R.L.,"Anunturi [proceduri de achizitie, beneficiari privati]: Documentatia de atribuire pentru achizitia de echipamente medicale",52928.67,Alba
