project_id,project_name,sector,ebrd_amount_eur,total_cost_eur,status,phase,borrower,implementing_entity,contact_person,contact_email,contact_phone,contractor_epc,contractor_email,contractor_phone,contractor_address,co_financiers,env_category,approval_date,notes
54948,Enguri HPP - Safety Upgrade (Phase V),Energy,28000000,35000000,Disbursing,Implementing,Georgia (sovereign),Engurhesi Ltd,,info@engurhesi.ge,+995 32 2 18 80 11,Tractebel Engineering SA (supervision/design),info@tractebel-engie.com,,Boulevard Simon Bolivar 34-36 1000 Brussels Belgium,EU (EUR 7.05M grant) + Japanese Government + KfW + EIB,B,2023-12-13,"Phase V: dam structural stability works, headrace tunnel rehab, generator circuit-breakers, relay protection, emergency valve, fish passage, road rehab. Enguri HPP = 1300 MW, 30% of Georgia electricity. Tractebel supervises all phases. Engurhesi contacts: Irakli Inashvili (Financial Dir), Paata Tsintsadze (Technical Dir), Fati Kakauridze (Org Manager), Mariam Kotua (PR). Address: Tbilisi 0186 Anna Politkovskaya St 8"
49649,Enguri HPP Climate Resilience Upgrade (Phase IV),Energy,38000000,45000000,Signed,Implementing,Georgia (sovereign),Engurhesi Ltd,,info@engurhesi.ge,+995 32 2 18 80 11,Tractebel Engineering SA,info@tractebel-engie.com,,Boulevard Simon Bolivar 34-36 1000 Brussels Belgium,EU + KfW + EIB,B,2019-10-30,"Phase IV extension: headrace tunnel and penstock rehabilitation. Expected +250 GWh production increase. Total EBRD financing across all Enguri phases: USD 112M"
50271,North-South Corridor (Kvesheti-Kobi) Road,Transport,53400000,497300000,Repaying,Implementing,Georgia (sovereign),Roads Department of Georgia,Givi Kveladze,givi.kveladze@georoad.ge,+995 32 237 05 08,"Lot 1: China Railway Tunnel Group (CRTG) - 9km tunnel; Lot 2: China Railway 23rd Bureau - road section",info@crtg.cn,,CRTG: Beijing China; Roads Dept: 12 Kazbegi Ave 0160 Tbilisi,ADB (EUR 370.2M) + Georgia (EUR 73.7M),A,2019-10-02,"23km bypass road, 5 tunnels (11.6km total incl 9km main tunnel), 6 bridges (1.6km total). EBRD finances Lot 1 (tunnel) only. Supervision: UBM International United Consultants (Turkey). Near completion 2025. Travel time 1h->15min. 4 workers died Nov 2025 retaining wall collapse"
52586,GrCF2 W1 - Tbilisi Metro Modernisation,Municipal Infrastructure,50600000,55600000,Disbursing,Implementing,Georgia (Ministry of Finance),Tbilisi Transport Company Ltd + City of Tbilisi,Tamar Machavariani,tmachavariani@metro.ge,+995322357777,"JV: Ardanuy Ingenieria SA (lead) + IRD Engineering (design/procurement support, EUR 4.2M contract)",madrid@ardanuy.com; info@irdeng.com,+34 917 99 45 00; +39 06.97611271,"Ardanuy: Av de Europa 34 Ed B 28023 Madrid Spain; IRD: Lungotevere delle Navi 30 00196 Roma Italy",Green Climate Fund (EUR 5M grant) + AIIB,B,2023-01-11,"Upgrade/rehabilitation of 12 metro stations: lighting, ventilation, energy-efficient escalators, drainage overhaul. Ardanuy-IRD JV for conceptual design and procurement support. Tbilisi Transport Company: Station Square 2 Tbilisi 0112. General: info@metro.ge"
51422,Power Grid Enhancement Project,Energy,90000000,267000000,Repaying,Implementing,Georgia (sovereign),Georgian State Electrosystem (GSE),Ekaterine Verulashvili,info@gse.com.ge,+(99532) 2 510 202,,,,"GSE: 2 Baratashvili Street Tbilisi 0108. Eka Verulashvili email: ekaterine.verulashvili@gse.com.ge","KfW + German Federal Ministry (EUR 120M) + EU NIP (EUR 10M grant)",A,2020-07-23,"4 components: 500kV OHL Tskaltubo-Akhaltsikhe-Tortum, North Ring (57km 220kV Nenskra-Mestia + Jvari substation + Nenskra substation + OHL Lajanuri-Tskaltubo + OHL Tskaltubo-Namakhvani-Tvishi-Lajanuri), Guria region reinforcement, Kakheti region reinforcement. Part of ENIP programme (EUR 270M total)"
55502,DFF SME - Marneuli Solar Power Plant (SPP),Energy,22100000,34900000,Approved,Implementing,ITEC LLC (SPV),Voltares Power Projects,Ioana Popescu,ioana.popescu@voltares.com,+43 676 4094837,Voltares Power Projects (sponsor/developer),office@voltares.com,,"Voltares: Lichtenfelsgasse 5/6 1010 Vienna Austria; ITEC: Tsagareli st. Tbilisi 0186",,B,2025-12-02,"Georgia's largest solar: 73 MW utility-scale PV in Marneuli (Kvemo Kartli, 30km south of Tbilisi). Expected 91.1 GWh/year output, -21077 tCO2/year. Co-financed by KfW IPEX-Bank. Founder: Cornelius Patt (Voltares). 100% green finance attribution"
51145,Green Investments in Buildings (GRIB),Municipal Infrastructure,40000000,50000000,Disbursing,Implementing,Georgia (Ministry of Finance),Municipal Development Fund (MDF),Davit Tabidze,mdf@mdf.org.ge,+995 32 2437001,,,,MDF: 3rd Floor #150 D. Aghmashenebeli Ave 0112 Tbilisi,EU NIP (EUR 10M investment grant),B,2022-03-09,"Energy efficiency upgrade and rehabilitation of ~200 public buildings (primarily schools). Expected -13333 tCO2/year, -253631 GJ/year energy savings. MDF website: mdf.ge. NOTE: Davit Tabidze detained Oct 2025 on abuse of office charges"
50842,Georgia Urban Transport Enhancement Programme,Municipal Infrastructure,19000000,24570000,Signed,Implementing,Georgia (Ministry of Finance),Municipal Development Fund (MDF),George Shengelia,mdf@mdf.org.ge,"+995 32 2437001 / +995 32 2437077",,,,MDF: 3rd Floor #150 D. Aghmashenebeli Ave 0112 Tbilisi,,B,2020-09-02,"~175 modern diesel Euro 5 buses for 6 secondary cities: Kutaisi, Gori, Telavi, Zugdidi, Rustavi, Poti. Corporate Development Programme for all cities. EUR 2.15M TC for transport reform + gender advisory"
54125,GrCF2 W1 - Tbilisi Waste Treatment Project,Municipal Infrastructure,22000000,26000000,Disbursing,Implementing,Georgia (Ministry of Finance),Tbilservice Group Ltd + City of Tbilisi,David Bodokia,dbodokia@gmail.com,+995 32 2619050,,,,Tbilservice: Isani-Samgori District Kakheti Highway 67 Tbilisi. www.tbsg.ge,,B,2023-12-05,"First waste treatment plant in Tbilisi: Materials Recovery Facility (MRF) for dry recyclables + Mechanical Biological Treatment (MBT) plant. Diverts waste from landfill. Tbilservice info@tbsg.ge. Director: David Pachulia"
54124,GrCF2 W2 E2 - Tbilisi Landfill Gas Project,Municipal Infrastructure,16000000,20000000,Disbursing,Implementing,Georgia (Ministry of Finance),Tbilservice Group Ltd + City of Tbilisi,David Bodokia,dbodokia@gmail.com,+995 32 2619050,,,,Tbilservice: Kakheti Highway 67 Tbilisi. www.tbsg.ge,E5P Fund (EUR 4M grant),B,2024-04-23,"Closure/remediation of Didi Lilo landfill cells + landfill gas collection/flaring/energy conversion system. Georgia's first gas-to-energy facility. Expected -75% GHG emissions. Serves 1.5M citizens"
52577,GrCF2 W2 - Tbilisi Municipal Services,Municipal Infrastructure,9600000,,Repaying,Implementing,Georgia (Ministry of Finance),Tbilservice Group Ltd + City of Tbilisi,David Bodokia,dbodokia@gmail.com,,,,,"Tbilservice: 7 Kakheti Highway 0182 Tbilisi. www.tbsg.ge",,B,2021-06-22,"Vehicles, machinery, equipment + digital route optimisation + truck pool management for solid waste, street lighting, street cleaning, drainage"
52825,GrCF2 W2 - Tbilisi Solid Waste Extension,Municipal Infrastructure,3030000,,Repaying,Implementing,Georgia (Ministry of Finance),Tbilservice Group Ltd + City of Tbilisi,David Bodokia,dbodokia@gmail.com,+995 577 262020,,,,Tbilservice: 67 Kakheti Highway Tbilisi,,B,2021-06-22,"Extension of leachate system upgrade at Tbilisi landfill from 2 cells to 4 cells"
47582,GrCF - Tbilisi Solid Waste,Municipal Infrastructure,15000000,,Repaying,Implementing,Georgia (sovereign),Tbilservice Group Ltd,Lasha Kajaia,l.kajaia@tbsg.ge,,,,,"Tbilservice Group Tbilisi",,B,2018-09-11,"Solid waste vehicles/machinery, transfer station upgrade, landfill rehabilitation. -18% CO2 (9596->7895 t/year). EUR 500K EU waste strategy TC"
52887,GrCF2 W1 - Adjara Solid Waste Phase II,Municipal Infrastructure,19000000,25000000,Disbursing,Implementing,Georgia (Ministry of Finance),Adjara Waste Management Company Ltd,Nodar Kontselidze,ajarawmcompany@gmail.com,,,,,"124 Vakhtang Gorgasali Street Batumi 6010",,B,2022-12-13,"New sanitary landfill in Adjara + waste sorting/treatment equipment. Stops disposal at non-EU-compliant dumpsites in Kobuleti and Batumi. EUR 2.47M implementation support TC"
53757,GrCF2 W2 - Project Medea (GGU Water),Municipal Infrastructure,40000000,300000000,Signed,Implementing,JSC Georgia Global Utilities (GGU),Georgia Global Utilities,Anastasia Asatiani,Ir@ggu.com,+995 322 931 111,,,,GGU: Medea (Mzia) Jugeli St N.10 0179 Tbilisi. www.ggu.com. Ownership: Aqualia (FCC Aqualia SA) 80% + Georgia Capital 20%,,B,2024-07-17,"EBRD subscribes USD 40M in USD 300M green Eurobond. Water network infrastructure improvements in Tbilisi. GGU supplies water/wastewater to 1.4M people. Second green bond under EBRD Green Cities"
51207,GrCF2 W2 - Tbilisi Bus Extension,Municipal Infrastructure,80000000,,Repaying,Implementing,Georgia (Ministry of Finance),Tbilisi Transport Company Ltd,Giorgi Dolidze,gdolidze@metro.ge,+995 577 228278,,,,Tbilisi Transport Company Station Square Tbilisi 0112. http://ttc.com.ge,,B,2019-11-27,"~modern 12m low-floor CNG buses + bus depot rehabilitation/modernisation. 2 tranches: EUR 65M + EUR 15M. EUR 975K TC for due diligence + reform + gender"
37560,Kobuleti Water,Municipal Infrastructure,3700000,18300000,Repaying,Completed,Georgia (sovereign),Kobuleti Water Company,,,,,,,"Kobuleti Municipality",,B,2007-07-10,"Water/wastewater network rehab, water meters, reservoir, wastewater treatment plant. EUR 1.5M original + EUR 2.2M extension for WWTP cost overrun"
36538,Adjara Solid Waste Project,Municipal Infrastructure,3000000,10000000,Complete,Completed,Georgia (sovereign),Hygiena 2009 Ltd,,,,,,,"Autonomous Republic of Adjara",Sweden/Sida (SEK 42M grant),A,2010-02-09,"New sanitary landfill at Tsetskhlauri + gas extraction + closure of 2 old landfills + recycling facility. EBRD Tbilisi: +995 32 2447400"
47431,Gori Wind Power Plant,Energy,12000000,34300000,Complete,Completed,Georgia,Qartli Windfarm LLC,Tornike Kazarashvili,t.kazarashvili@gedf.com.ge,+995 599 88 44 24,Vestas (turbines),,,GEDF: 8 Baratashvili Street 4th floor 0105 Tbilisi,OIKOCREDIT + Triodos Groenfonds + Green for Growth Fund,B,2015-12-16,"First wind farm in South Caucasus. 20.7 MW, 6x Vestas V117-3.45MW. Operational since 2017. ~88 GWh/year actual output (exceeded forecast). Owned by GEDF (state)"
51392,GrCF2 W1 - Tbilisi Metro Project,Municipal Infrastructure,65000000,75000000,Complete,Completed,Georgia (Ministry of Finance),Tbilisi Transport Company Ltd,Gvanca Pirpirashvili,GPirpirashvili@metro.ge,+995577082151,,,,Tbilisi Transport Company 2 Station Square Tbilisi 0112,Green Climate Fund,B,2020-04-23,"~40 modern metro cars (10 train sets) + metro depot and tunnel rehabilitation. Completed"
46778,Nenskra HPP,Energy,214000000,1083000000,Cancelled,Cancelled,JSC Nenskra Hydro,Korea Water Resources Corp (K-Water),Young-Tak Choi,,+995-322-43-0419,,,,Mestia Municipality Svaneti region,AIIB + EIB,A,2018-01-31,"280 MW on Nenskra/Nakra rivers, 130m dam. CANCELLED. Non-compliant findings by EBRD/EIB on indigenous rights, cultural heritage, stakeholder consultation. K-Water (South Korea) 90% + Partnership Fund 10%"
48104,GrCF - Batumi Bus,Municipal Infrastructure,5500000,,Repaying,Implementing,Georgia (Ministry of Finance),Batumi Autotransport LLC,Giorgi Koncelidze,info@batauto.ge,+995422247676,,,,13 Sulkhan-Saba Orbeliani Str. Batumi,E5P Fund (EUR 1.5M grant),B,,"10 electric buses for Batumi. Completed delivery. Corporate Development Programme + Green City Action Plan for Batumi"
